902286520375283712,Pray for us! Still raining. .material things can be replaced!… https://t.co/gcxTk41ypV,pray still rain material things replace,Mon Aug 28 16:47:24 CDT 2017,"29.65941153,-95.31175519",MamaCashcow,Houston,"Houston, TX","(29.522325,-95.823268),(30.154665,-95.823268),(30.154665,-95.069705),(29.522325,-95.069705),",42,Westbury,,0
902286812139290625,"Interested in a #job in #Houston, TX? This could be a great fit: https://t.co/Tgh1EVLLL2 #SupplyChain #Hiring… https://t.co/nZ6woFnM7X",interest could great fit,Mon Aug 28 16:48:34 CDT 2017,"29.7604267,-95.3698028",GDKN,Houston,"Houston, TX","(29.522325,-95.823268),(30.154665,-95.823268),(30.154665,-95.069705),(29.522325,-95.069705),",1,Fourth Ward,,0
902286941101613056,"If you're looking for work in #Houston, TX, check out this #job: https://t.co/sSmi7mDYTW #Education #Hiring #CareerArc",youre looking work check,Mon Aug 28 16:49:05 CDT 2017,"29.6822289,-95.5569074",tmj_hou_edu,Houston,"Houston, TX","(29.522325,-95.823268),(30.154665,-95.823268),(30.154665,-95.069705),(29.522325,-95.069705),",1,Fourth Ward,,0
902286992855056384,"Want to work in #Houston, TX? View our latest opening: https://t.co/tteTjEaC9k #BusinessMgmt #Job #Jobs #Hiring #CareerArc",want work view latest opening,Mon Aug 28 16:49:17 CDT 2017,"29.7331398,-95.4354701",tmj_hou_mgmt,Houston,"Houston, TX","(29.522325,-95.823268),(30.154665,-95.823268),(30.154665,-95.069705),(29.522325,-95.069705),",1,Fourth Ward,,0
902287012442644480,"This is just insane. Please be safe everyone. Too scary. #hurricaneharvey @ Houston, Texas https://t.co/jLPdsVJMdg",insane please safe everyone scary texas,Mon Aug 28 16:49:22 CDT 2017,"29.7629,-95.3832",jlhays,Houston,"Houston, TX","(29.522325,-95.823268),(30.154665,-95.823268),(30.154665,-95.069705),(29.522325,-95.069705),",52,Medical Center Area,safe,1
902287161004761088,"Can you recommend anyone for this #job in #Houston, TX? https://t.co/45cgOzsTnu #BusinessMgmt #Hiring #CareerArc",recommend anyone,Mon Aug 28 16:49:57 CDT 2017,"29.9650504,-95.3348546",HouJobs,Houston,"Houston, TX","(29.522325,-95.823268),(30.154665,-95.823268),(30.154665,-95.069705),(29.522325,-95.069705),",5,Eldridge / West Oaks,,0
902287403649441792,"Join the Lowe's Stores team! See our latest #job opening here: https://t.co/ErjBXMiydb #Houston, TX #Hiring #CareerArc",join low store team see latest opening,Mon Aug 28 16:50:55 CDT 2017,"29.7863781,-95.5280841",tmj_hou_jobs,Houston,"Houston, TX","(29.522325,-95.823268),(30.154665,-95.823268),(30.154665,-95.069705),(29.522325,-95.069705),",30,Downtown,store,1
902287582410702849,"Thank you to everyone helping out physically and through social media, our city is underwater… https://t.co/MtvrHG5v7h",thank everyone helping physically social medium city underwater,Mon Aug 28 16:51:37 CDT 2017,"29.7629,-95.3832",erickesk,Houston,"Houston, TX","(29.522325,-95.823268),(30.154665,-95.823268),(30.154665,-95.069705),(29.522325,-95.069705),",62,Macgregor,,0
902287778012053504,[05:29:55] 201.190.132.170:16813 >> :5358 (TCP:SYN),tcpsyn,Mon Aug 28 16:52:24 CDT 2017,"29.7633,-95.3633",infosrv,Houston,"Houston, TX","(29.522325,-95.823268),(30.154665,-95.823268),(30.154665,-95.069705),(29.522325,-95.069705),",1,Fourth Ward,,0
902288043230478340,"See our latest #Houston, TX #job and click to apply: Cashier - Restaurant Team Member - https://t.co/99myjjqOYI #BostonMarket #FastCasual",see latest click apply cashier restaurant team member,Mon Aug 28 16:53:27 CDT 2017,"29.8831931,-95.6444698",BostonMarketJob,Houston,"Houston, TX","(29.522325,-95.823268),(30.154665,-95.823268),(30.154665,-95.069705),(29.522325,-95.069705),",23,Midtown,restaurant,1
902288092492640256,If y'all in Pearland please help right now....  #Repost @heat_bxtch (get_repost) ・・・ Lawd my… https://t.co/PWBz3beUeH,yall pearland please help right heatbxtch getrepost lawd,Mon Aug 28 16:53:39 CDT 2017,"29.7629,-95.3832",MrWiredUpOhBoy,Houston,"Houston, TX","(29.522325,-95.823268),(30.154665,-95.823268),(30.154665,-95.069705),(29.522325,-95.069705),",52,Medical Center Area,help,1
902288170707968000,"Repost theindustryonblastx  . . . #houston #prayersforhouston #texas #share #rescue @ Houston,… https://t.co/ndCln4YS7T",repost theindustryonblastx,Mon Aug 28 16:53:58 CDT 2017,"29.7629,-95.3832",SFCentric,Houston,"Houston, TX","(29.522325,-95.823268),(30.154665,-95.823268),(30.154665,-95.069705),(29.522325,-95.069705),",1,Fourth Ward,,0
902288230694871042,"Drone footage of some of the flooding from @Chase_Boogie. Toward the end, you can see shots of… https://t.co/kqQ2GRJJyk",drone footage flooding chaseboogie toward end see shot,Mon Aug 28 16:54:12 CDT 2017,"29.76086,-95.36501",Braden_Keith,Houston,"Houston, TX","(29.522325,-95.823268),(30.154665,-95.823268),(30.154665,-95.069705),(29.522325,-95.069705),",80,Greater Third Ward,,0
902288338857598976,"Interested in a #job in #Houston, TX? This could be a great fit: https://t.co/9V31nW8tNK #Legal #Hiring #CareerArc",interest could great fit,Mon Aug 28 16:54:38 CDT 2017,"29.7427692,-95.5594327",tmj_hou_legal,Houston,"Houston, TX","(29.522325,-95.823268),(30.154665,-95.823268),(30.154665,-95.069705),(29.522325,-95.069705),",42,Westbury,,0
902288381979262976,#Partytime #HappyBday #Beer #HurricanHarvey2017 #Aug.28th @ Lindale Park https://t.co/zfrWJvT6t9,park,Mon Aug 28 16:54:48 CDT 2017,"29.8085,-95.3695",cdezz2,Houston,"Houston, TX","(29.522325,-95.823268),(30.154665,-95.823268),(30.154665,-95.069705),(29.522325,-95.069705),",30,Downtown,,0
902288835010166784,"See our latest #Houston, TX #job and click to apply: General Clerk I - https://t.co/Pk4Gi7sNNH #Clerical #Hiring #CareerArc",see latest click apply general clerk,Mon Aug 28 16:56:36 CDT 2017,"29.6488258,-95.4871681",tmj_hou_cler,Houston,"Houston, TX","(29.522325,-95.823268),(30.154665,-95.823268),(30.154665,-95.069705),(29.522325,-95.069705),",1,Fourth Ward,,0
902288873501351936,"We're #hiring! Read about our latest #job opening here: Bilingual Teacher - North Houston - https://t.co/NJRmdSKr8b #Education #Houston, TX",read latest opening bilingual teacher north houston,Mon Aug 28 16:56:45 CDT 2017,"29.6822289,-95.5569074",tmj_hou_edu,Houston,"Houston, TX","(29.522325,-95.823268),(30.154665,-95.823268),(30.154665,-95.069705),(29.522325,-95.069705),",30,Downtown,,0
902288995245146112,We've entered One Hundred Years of Solitude.  #harveywontleave #gabrielgarciamarquez @ Heights Area https://t.co/WVetCBb1xw,weve enter one hundred years solitude area,Mon Aug 28 16:57:14 CDT 2017,"29.80874602,-95.39924531",magicfishbones,Houston,"Houston, TX","(29.522325,-95.823268),(30.154665,-95.823268),(30.154665,-95.069705),(29.522325,-95.069705),",30,Downtown,,0
902289265488302080,"Join the Rice University team! See our latest #job opening here: https://t.co/siWRZ3ezTN #GeneralScience #Houston, TX #Hiring #CareerArc",join rice university team see latest opening,Mon Aug 28 16:58:19 CDT 2017,"29.7184075,-95.3980766",tmj_HOU_gensci,Houston,"Houston, TX","(29.522325,-95.823268),(30.154665,-95.823268),(30.154665,-95.069705),(29.522325,-95.069705),",52,Medical Center Area,,0
902289351068966912,#Repost htxtactical (get_repost) ・・・ Stay Strong Houston. Here are some pictures so you can see… https://t.co/C4uNRex69t,htxtactical getrepost stay strong houston picture see,Mon Aug 28 16:58:39 CDT 2017,"29.8531,-95.5149",anointedsoulz,Houston,"Houston, TX","(29.522325,-95.823268),(30.154665,-95.823268),(30.154665,-95.069705),(29.522325,-95.069705),",1,Fourth Ward,,0
902289512973336576,Helicopters keep flying back and forth and every time I hear one I feel better. I know someone… https://t.co/L7uC3lKOrW,helicopter keep flying back forth every time hear one feel better know someone,Mon Aug 28 16:59:18 CDT 2017,"29.76182363,-95.39310088",AmabyAisha,Houston,"Houston, TX","(29.522325,-95.823268),(30.154665,-95.823268),(30.154665,-95.069705),(29.522325,-95.069705),",1,Fourth Ward,,0
902289582850416640,"Interested in a #job in #Houston, TX? This could be a great fit: https://t.co/hAYLBIXH7x #Nursing #Hiring #CareerArc",interest could great fit,Mon Aug 28 16:59:34 CDT 2017,"29.7604267,-95.3698028",tmj_hou_nursing,Houston,"Houston, TX","(29.522325,-95.823268),(30.154665,-95.823268),(30.154665,-95.069705),(29.522325,-95.069705),",62,Macgregor,,0
902289588198277120,"Want to work in #Houston, TX? View our latest opening: https://t.co/UYi6DKvsss #cook #Foodie #Cook #Job #Jobs #Hiring",want work view latest opening,Mon Aug 28 16:59:36 CDT 2017,"29.7604267,-95.3698028",HMSHostCareers,Houston,"Houston, TX","(29.522325,-95.823268),(30.154665,-95.823268),(30.154665,-95.069705),(29.522325,-95.069705),",1,Fourth Ward,,0
902289679185133568,"Interested in a #job in #Houston, TX? This could be a great fit: https://t.co/fgxL9X2g3c #Finance #Hiring #CareerArc",interest could great fit,Mon Aug 28 16:59:57 CDT 2017,"29.7604267,-95.3698028",tmj_hou_finance,Houston,"Houston, TX","(29.522325,-95.823268),(30.154665,-95.823268),(30.154665,-95.069705),(29.522325,-95.069705),",30,Downtown,,0
902289753348816896,I am looking for a buyer on 4902 Wigton Drive #Houston #TX  #realestate https://t.co/DDF5aahJyA https://t.co/65Bko3Osrz,looking buyer wigton drive,Mon Aug 28 17:00:15 CDT 2017,"29.673207,-95.461663",HoustonHomes_4U,Houston,"Houston, TX","(29.522325,-95.823268),(30.154665,-95.823268),(30.154665,-95.069705),(29.522325,-95.069705),",30,Downtown,,0
902289929559998464,beyonce @floydmayweather @tdjakesshow @Drake #HOUSTON NEEDS YOU!!! #PRAYFORHOUSTON 🙏🙏🙏 @… https://t.co/8a2mMbvgrX,beyonce floydmayweather tdjakesshow drake need,Mon Aug 28 17:00:57 CDT 2017,"29.7629,-95.3832",djwildhairr,Houston,"Houston, TX","(29.522325,-95.823268),(30.154665,-95.823268),(30.154665,-95.069705),(29.522325,-95.069705),",30,Downtown,need,1
902289983930855424,"I'm at The Marvelous Land of Oz in Houston, TX https://t.co/oIMrIZ90C3",marvelous land houston,Mon Aug 28 17:01:10 CDT 2017,"29.739989,-95.33366",Lil_J_RockStarr,Houston,"Houston, TX","(29.522325,-95.823268),(30.154665,-95.823268),(30.154665,-95.069705),(29.522325,-95.069705),",1,Fourth Ward,,0
902290358645669888,"Our thoughts, prayers, love to all those affected by #HurricaneHarvey. 💔 #Truckers... stay safe… https://t.co/rau00aqZFG",thought prayer love affect stay safe,Mon Aug 28 17:02:39 CDT 2017,"29.7629,-95.3832",TNationNetwork,Houston,"Houston, TX","(29.522325,-95.823268),(30.154665,-95.823268),(30.154665,-95.069705),(29.522325,-95.069705),",1,Fourth Ward,safe,1
902290623863984128,Rescue teams are still working & heavy disaster relief efforts are underway for those displaced… https://t.co/MLhZ8nsHEF,rescue team still working heavy disaster relief effort underway displace,Mon Aug 28 17:03:43 CDT 2017,"29.7629,-95.3832",RUNStudentsBlt,Houston,"Houston, TX","(29.522325,-95.823268),(30.154665,-95.823268),(30.154665,-95.069705),(29.522325,-95.069705),",30,Downtown,rescue relief,2
902290896615424000,"Can you recommend anyone for this #job? Client Director, Asian Corporate Solutions - https://t.co/aQJSiglcdH #Marketing #Houston, TX",recommend anyone client director asian corporate solution,Mon Aug 28 17:04:48 CDT 2017,"29.7602083,-95.3944657",tmj_hou_adv,Houston,"Houston, TX","(29.522325,-95.823268),(30.154665,-95.823268),(30.154665,-95.069705),(29.522325,-95.069705),",1,Fourth Ward,,0
902291138404483073,"Interested in a #job in #Houston, TX? This could be a great fit: https://t.co/B2TLaP4m6K #Nursing #Hiring",interest could great fit,Mon Aug 28 17:05:45 CDT 2017,"29.7604267,-95.3698028",USMMCareers,Houston,"Houston, TX","(29.522325,-95.823268),(30.154665,-95.823268),(30.154665,-95.069705),(29.522325,-95.069705),",78,University Place,,0
902291277361721344,"We're #hiring! Read about our latest #job opening here: DCV Diabetes Specialty Sales Professional - Houston,... - https://t.co/bHnvl8uA2K",read latest opening dcv diabetes specialty sales professional houston,Mon Aug 28 17:06:18 CDT 2017,"29.7604267,-95.3698028",tmj_hou_sales,Houston,"Houston, TX","(29.522325,-95.823268),(30.154665,-95.823268),(30.154665,-95.069705),(29.522325,-95.069705),",30,Downtown,,0
902291553468596224,"See our latest #Houston, TX #job and click to apply: Senior Research Assistant - Immuno Therapy - https://t.co/8x5SusPdmX #Healthcare",see latest click apply senior research assistant immuno therapy,Mon Aug 28 17:07:24 CDT 2017,"29.7604267,-95.3698028",tmj_hou_health,Houston,"Houston, TX","(29.522325,-95.823268),(30.154665,-95.823268),(30.154665,-95.069705),(29.522325,-95.069705),",1,Fourth Ward,,0
902292046253314048,Addicks Barker TX Mon Aug 28th PM Forecast: TONIGHT Tropical Storm Conditions Lo 71 TUESDAY Tropical Storm Conditions Hi 79,addicks barker mon aug forecast tonight tropical storm conditions tuesday tropical storm conditions,Mon Aug 28 17:09:22 CDT 2017,"29.8301,-95.6661",AddicksBarker,Houston,"Houston, TX","(29.522325,-95.823268),(30.154665,-95.823268),(30.154665,-95.069705),(29.522325,-95.069705),",30,Downtown,,0
902292089576271872,"Donating what we can. (@ George R. Brown Convention Center - @grbcc in Houston, TX) https://t.co/xJ5UqomHgs",donate brown convention center grbcc houston,Mon Aug 28 17:09:32 CDT 2017,"29.75210153,-95.35828114",P1NK_PUMA,Houston,"Houston, TX","(29.522325,-95.823268),(30.154665,-95.823268),(30.154665,-95.069705),(29.522325,-95.069705),",6,Washington Avenue Coalition / Memorial Park,donate,1
902292152134156288,"Interested in a #job in #Houston, TX? This could be a great fit: https://t.co/RSIhnuh2oA #BusinessMgmt #Hiring #CareerArc",interest could great fit,Mon Aug 28 17:09:47 CDT 2017,"29.9361441,-95.3414252",tmj_hou_mgmt,Houston,"Houston, TX","(29.522325,-95.823268),(30.154665,-95.823268),(30.154665,-95.069705),(29.522325,-95.069705),",30,Downtown,,0
902292233042497537,Sharpstown TX Mon Aug 28th PM Forecast: TONIGHT Tropical Storm Conditions Lo 71 TUESDAY Tropical Storm Conditions Hi 79,sharpstown mon aug forecast tonight tropical storm conditions tuesday tropical storm conditions,Mon Aug 28 17:10:06 CDT 2017,"29.7004,-95.5366",SharpstownTX,Houston,"Houston, TX","(29.522325,-95.823268),(30.154665,-95.823268),(30.154665,-95.069705),(29.522325,-95.069705),",30,Downtown,,0
902292279519363072,"We're #hiring! Read about our latest #job opening here: Delivery Driver - https://t.co/KCpGAkoa6j #Transportation #Houston, TX #CareerArc",read latest opening delivery driver,Mon Aug 28 17:10:17 CDT 2017,"29.6994886,-95.3016667",tmj_hou_transp,Houston,"Houston, TX","(29.522325,-95.823268),(30.154665,-95.823268),(30.154665,-95.069705),(29.522325,-95.069705),",30,Downtown,,0
902292410083885059,"See our latest #Houston, Texas #job and click to apply: Full Time Hospice On-Call Registered Nurse - https://t.co/W5zqy2wjjO #Nursing",see latest texas click apply full time hospice oncall register nurse,Mon Aug 28 17:10:49 CDT 2017,"29.7604267,-95.3698028",tmj_hou_nursing,Houston,"Houston, TX","(29.522325,-95.823268),(30.154665,-95.823268),(30.154665,-95.069705),(29.522325,-95.069705),",62,Macgregor,nurse,1
902292493244317697,"Want to work in #Houston, TX? View our latest opening: https://t.co/FKUKcRHvgh #Retail #Job #Jobs #Hiring",want work view latest opening,Mon Aug 28 17:11:08 CDT 2017,"29.7604267,-95.3698028",tmj_hou_retail,Houston,"Houston, TX","(29.522325,-95.823268),(30.154665,-95.823268),(30.154665,-95.069705),(29.522325,-95.069705),",52,Medical Center Area,,0
902292593157001223,We lost power at the restaurant but we're still able to make pizzas at our soon-to-be-open… https://t.co/UxLfshtKbj,lost power restaurant still able make pizza soontobeopen,Mon Aug 28 17:11:32 CDT 2017,"29.75576,-95.3675",frankspizzaTX,Houston,"Houston, TX","(29.522325,-95.823268),(30.154665,-95.823268),(30.154665,-95.069705),(29.522325,-95.069705),",1,Fourth Ward,power restaurant,2
902292623075012608,High water affecting all main lanes in #Downtown on Hwy 288 NB at Southmore #traffic https://t.co/vuUN2yElDh,high water affect main lane hwy southmore,Mon Aug 28 17:11:39 CDT 2017,"29.72198,-95.3767",TotalTrafficHOU,Houston,"Houston, TX","(29.522325,-95.823268),(30.154665,-95.823268),(30.154665,-95.069705),(29.522325,-95.069705),",52,Medical Center Area,water,1
902292684752117760,"Houston Airport underwater... as the caption reads, the planes tails… https://t.co/T2XQRTqBOh",houston airport underwater caption read plane tails,Mon Aug 28 17:11:54 CDT 2017,"29.98444444,-95.34138889",rydintl1,Houston,"Houston, TX","(29.522325,-95.823268),(30.154665,-95.823268),(30.154665,-95.069705),(29.522325,-95.069705),",73,Clear Lake,,0
902292703664234496,"Can you recommend anyone for this #job? Software Engineer - https://t.co/uujulfKLiW #IT #Houston, TX #Hiring #CareerArc",recommend anyone software engineer,Mon Aug 28 17:11:58 CDT 2017,"29.75888,-95.3638571",tmj_HOU_adm,Houston,"Houston, TX","(29.522325,-95.823268),(30.154665,-95.823268),(30.154665,-95.069705),(29.522325,-95.069705),",1,Fourth Ward,,0
902292784719245313,Exit blocked due to flooding on Hwy 288 NB at The S Lp #traffic https://t.co/vuUN2yElDh,exit block due flooding hwy,Mon Aug 28 17:12:18 CDT 2017,"29.68057,-95.38122",TotalTrafficHOU,Houston,"Houston, TX","(29.522325,-95.823268),(30.154665,-95.823268),(30.154665,-95.069705),(29.522325,-95.069705),",1,Fourth Ward,,0
902292890222698496,"For anyone stranded ‼️ #houston #hurricaneharvey @ Houston, Texas https://t.co/yeMymxnpLR",anyone strand texas,Mon Aug 28 17:12:43 CDT 2017,"29.7629,-95.3832",DessiiWorld,Houston,"Houston, TX","(29.522325,-95.823268),(30.154665,-95.823268),(30.154665,-95.069705),(29.522325,-95.069705),",1,Fourth Ward,,0
902293125313462272,High water affecting all main lanes in #Downtown on Hwy 288 SB between Southmore and Holly Hall #traffic https://t.co/vuUN2yElDh,high water affect main lane hwy southmore holly hall,Mon Aug 28 17:13:39 CDT 2017,"29.72198,-95.3767",TotalTrafficHOU,Houston,"Houston, TX","(29.522325,-95.823268),(30.154665,-95.823268),(30.154665,-95.069705),(29.522325,-95.069705),",88,Neartown - Montrose,water,1
902293186911105024,People so dam ignorant for this bruh I swear ! Mfs can't just help out without being accused of… https://t.co/OdMDJAlHs3,people dam ignorant bruh swear cant help without accused,Mon Aug 28 17:13:54 CDT 2017,"29.7629,-95.3832",DessiiWorld,Houston,"Houston, TX","(29.522325,-95.823268),(30.154665,-95.823268),(30.154665,-95.069705),(29.522325,-95.069705),",25,Memorial,help people,2
902293379706273793,"Can you recommend anyone for this #job in #Houston, TX? https://t.co/D8H1hLV7vD #Cosmetology #Hiring",recommend anyone,Mon Aug 28 17:14:40 CDT 2017,"29.5986025,-95.352404",tmj_hou_cosmo,Houston,"Houston, TX","(29.522325,-95.823268),(30.154665,-95.823268),(30.154665,-95.069705),(29.522325,-95.069705),",30,Downtown,,0
902293470030811136,"Please share!!!  Attention homeowners impacted by Hurricane Harvey:  EFFECTIVE FRIDAY, the laws… https://t.co/3yMM6G8BGq",please share attention homeowner impact hurricane harvey effective friday laws,Mon Aug 28 17:15:01 CDT 2017,"29.7629,-95.3832",RealtorSharena,Houston,"Houston, TX","(29.522325,-95.823268),(30.154665,-95.823268),(30.154665,-95.069705),(29.522325,-95.069705),",1,Fourth Ward,,0
902293586510659584,"Join the Simon team! See our latest #job opening here: https://t.co/UE1cuUBhe4 #Simon #Clerical #Cypress, TX #Hiring #CareerArc",join simon team see latest opening,Mon Aug 28 17:15:29 CDT 2017,"29.9716905,-95.6937856",SimonCareers,Houston,"Houston, TX","(29.522325,-95.823268),(30.154665,-95.823268),(30.154665,-95.069705),(29.522325,-95.069705),",30,Downtown,,0
902293601492848642,Exit blocked due to flooding in #NorthSide on The Hardy Tollroad SB at Crosstimbers #traffic https://t.co/vuUN2yElDh,exit block due flooding hardy tollroad crosstimbers,Mon Aug 28 17:15:33 CDT 2017,"29.8228,-95.35573",TotalTrafficHOU,Houston,"Houston, TX","(29.522325,-95.823268),(30.154665,-95.823268),(30.154665,-95.069705),(29.522325,-95.069705),",62,Macgregor,,0
902293746687008768,"Can you recommend anyone for this #job in #Houston, TX? https://t.co/noqIZgwwnw #Engineering #Hiring",recommend anyone,Mon Aug 28 17:16:07 CDT 2017,"29.7604267,-95.3698028",tmj_hou_eng,Houston,"Houston, TX","(29.522325,-95.823268),(30.154665,-95.823268),(30.154665,-95.069705),(29.522325,-95.069705),",1,Fourth Ward,,0
902293884721496065,"Can you recommend anyone for this #job in #Houston, TX? https://t.co/uKp1Llocyd #BusinessMgmt #Hiring #CareerArc",recommend anyone,Mon Aug 28 17:16:40 CDT 2017,"29.7602083,-95.3944657",tmj_hou_mgmt,Houston,"Houston, TX","(29.522325,-95.823268),(30.154665,-95.823268),(30.154665,-95.069705),(29.522325,-95.069705),",52,Medical Center Area,,0
902293978720202753,@YenAna 👀 auntie yen got her some prettyyyyy clothing Harvey can't… https://t.co/YbQ8AsYm78,yenana auntie yen get prettyyyyy clothing harvey cant,Mon Aug 28 17:17:02 CDT 2017,"29.7629,-95.3832",ShenCynthia,Houston,"Houston, TX","(29.522325,-95.823268),(30.154665,-95.823268),(30.154665,-95.069705),(29.522325,-95.069705),",25,Memorial,,0
902294081996513283,Anyone needing shelter in the #cypresstx #katytx area ... berrycenter is open ‼️… https://t.co/NqrwJClFP5,anyone need shelter area berrycenter open,Mon Aug 28 17:17:27 CDT 2017,"29.7629,-95.3832",DessiiWorld,Houston,"Houston, TX","(29.522325,-95.823268),(30.154665,-95.823268),(30.154665,-95.069705),(29.522325,-95.069705),",30,Downtown,need shelter,2
902294231842254849,"#USGS08068780 - Little Cypress Ck nr Cypress, TX Height: 160.03ft ▲ (156.5ft) Flow: 4820cfs https://t.co/UIe6tv4H8K",little cypress cypress height flow,Mon Aug 28 17:18:03 CDT 2017,"30.01605437,-95.6974463",USGS_TexasFlood,Houston,"Houston, TX","(29.522325,-95.823268),(30.154665,-95.823268),(30.154665,-95.069705),(29.522325,-95.069705),",52,Medical Center Area,,0
902294334086590464,"Can you recommend anyone for this #job in #Houston, TX? https://t.co/AofMmmDv3n #Healthcare #Hiring #CareerArc",recommend anyone,Mon Aug 28 17:18:27 CDT 2017,"29.7604267,-95.3698028",tmj_hou_health,Houston,"Houston, TX","(29.522325,-95.823268),(30.154665,-95.823268),(30.154665,-95.069705),(29.522325,-95.069705),",68,Gulfgate Riverview / Pine Valley,,0
902294398406246400,Omg stay strong Texas! #prayforhouston #harvey #myvilliage #staystrong #허리케인하비 #htown #floodcity… https://t.co/0kckiPkWgt,omg stay strong texas,Mon Aug 28 17:18:43 CDT 2017,"29.7629,-95.3832",flyhighmiri,Houston,"Houston, TX","(29.522325,-95.823268),(30.154665,-95.823268),(30.154665,-95.069705),(29.522325,-95.069705),",22,Mid West,,0
902294508746018816,"#SpringfieldIL #HoustonTX #HurricaneHarvey #HoustonFlood 🙏 #HoustonStrong @ Houston, Texas https://t.co/NVG4i8umBe",texas,Mon Aug 28 17:19:09 CDT 2017,"29.7629,-95.3832",AJWoodson,Houston,"Houston, TX","(29.522325,-95.823268),(30.154665,-95.823268),(30.154665,-95.069705),(29.522325,-95.069705),",1,Fourth Ward,,0
902294604459986946,Thank goodness for the National Guard & Coast Guard for rescuing my family from their homes in… https://t.co/Z9ynBsE8Gf,thank goodness national guard coast guard rescue family home,Mon Aug 28 17:19:32 CDT 2017,"29.7629,-95.3832",swimhardy,Houston,"Houston, TX","(29.522325,-95.823268),(30.154665,-95.823268),(30.154665,-95.069705),(29.522325,-95.069705),",1,Fourth Ward,home family rescue,3
902294657933160456,Shrimp and Grits - Drinking a Yellow Rose by @lonepint at @downhousehtx  — https://t.co/FfV9ImOxgq #photo,shrimp grits drinking yellow rose lonepint downhousehtx,Mon Aug 28 17:19:44 CDT 2017,"29.8021,-95.3994",pheealzabub,Houston,"Houston, TX","(29.522325,-95.823268),(30.154665,-95.823268),(30.154665,-95.069705),(29.522325,-95.069705),",6,Washington Avenue Coalition / Memorial Park,,0
902294687515635712,"#HurricaneHarvey @ Houston, Texas https://t.co/wLUvs3G96h",texas,Mon Aug 28 17:19:51 CDT 2017,"29.7629,-95.3832",KillaB_19,Houston,"Houston, TX","(29.522325,-95.823268),(30.154665,-95.823268),(30.154665,-95.069705),(29.522325,-95.069705),",62,Macgregor,,0
902294796672176129,"Can you recommend anyone for this #job in #Houston, TX? https://t.co/lMeSxB105H #Transportation #Hiring",recommend anyone,Mon Aug 28 17:20:18 CDT 2017,"29.7604267,-95.3698028",tmj_hou_transp,Houston,"Houston, TX","(29.522325,-95.823268),(30.154665,-95.823268),(30.154665,-95.069705),(29.522325,-95.069705),",1,Fourth Ward,,0
902294985084727296,@JustRoseBuds GRB,justrosebuds grb,Mon Aug 28 17:21:02 CDT 2017,"29.74913,-95.356216",WinkWestwood,Houston,"Houston, TX","(29.522325,-95.823268),(30.154665,-95.823268),(30.154665,-95.069705),(29.522325,-95.069705),",1,Fourth Ward,,0
902295164965847040,#HurricaneHarvey: #rescueteam ready! #Repost @loumuzik ・・・ RESCUER… https://t.co/spX6s38xqV,ready loumuzik rescuer,Mon Aug 28 17:21:45 CDT 2017,"29.7629,-95.3832",thedijitaldj,Houston,"Houston, TX","(29.522325,-95.823268),(30.154665,-95.823268),(30.154665,-95.069705),(29.522325,-95.069705),",74,South Park,,0
902295236830834688,"Interested in a #job in #Houston, Texas? This could be a great fit: https://t.co/OHEE8OFx8H #Nursing #Hiring",interest texas could great fit,Mon Aug 28 17:22:02 CDT 2017,"29.7604267,-95.3698028",tmj_hou_nursing,Houston,"Houston, TX","(29.522325,-95.823268),(30.154665,-95.823268),(30.154665,-95.069705),(29.522325,-95.069705),",20,Museum Park,,0
902295600732844036,"Interested in a #job in #Houston, TX? This could be a great fit: https://t.co/td479oo5rY #BusinessMgmt #Hiring #CareerArc",interest could great fit,Mon Aug 28 17:23:29 CDT 2017,"29.7372498,-95.4618607",tmj_hou_mgmt,Houston,"Houston, TX","(29.522325,-95.823268),(30.154665,-95.823268),(30.154665,-95.069705),(29.522325,-95.069705),",30,Downtown,,0
902295644521594881,"Harvey 🌧 @ Houston, Texas https://t.co/qlJmpSyWgh",harvey texas,Mon Aug 28 17:23:40 CDT 2017,"29.7629,-95.3832",bayurohaizad,Houston,"Houston, TX","(29.522325,-95.823268),(30.154665,-95.823268),(30.154665,-95.069705),(29.522325,-95.069705),",22,Mid West,,0
