901928743668785152,Houston TX Sun Aug 27th PM Forecast: TONIGHT Tropical Storm Conditions Lo 71 MONDAY Tropical Storm Conditions Hi 79,houston sun aug forecast tonight tropical storm conditions monday tropical storm conditions,Sun Aug 27 17:05:44 CDT 2017,"29.7634,-95.3634",HoustonTX_,Houston,"Houston, TX","(29.522325,-95.823268),(30.154665,-95.823268),(30.154665,-95.069705),(29.522325,-95.069705),",14,Iah / Airport Area,,0
901928839336660992,Sharpstown TX Sun Aug 27th PM Forecast: TONIGHT Tropical Storm Conditions Lo 71 MONDAY Tropical Storm Conditions Hi 79,sharpstown sun aug forecast tonight tropical storm conditions monday tropical storm conditions,Sun Aug 27 17:06:06 CDT 2017,"29.7004,-95.5366",SharpstownTX,Houston,"Houston, TX","(29.522325,-95.823268),(30.154665,-95.823268),(30.154665,-95.069705),(29.522325,-95.069705),",43,Spring Branch Central,,0
901928993322033153,"Want to work at 24 Hour Fitness? We're #hiring in #Spring, TX! Click for details: https://t.co/6bryaznPYr #saleslife #sales #Job #Jobs",want work hour fitness click details,Sun Aug 27 17:06:43 CDT 2017,"30.038963,-95.488927",tmj_hou_sales,Houston,"Houston, TX","(29.522325,-95.823268),(30.154665,-95.823268),(30.154665,-95.069705),(29.522325,-95.069705),",1,Fourth Ward,,0
901929320993611776,"This #job might be a great fit for you: Unit Administrative Assistant - https://t.co/JxinH0Puie #Clerical #Houston, TX #Hiring #CareerArc",might great fit unit administrative assistant,Sun Aug 27 17:08:01 CDT 2017,"29.7604267,-95.3698028",tmj_hou_cler,Houston,"Houston, TX","(29.522325,-95.823268),(30.154665,-95.823268),(30.154665,-95.069705),(29.522325,-95.069705),",4,Greater Hobby Area,,0
901929493585059840,"Want to work in #Houston, TX? View our latest opening: https://t.co/UnLCnCE9si #NursePractitioner #Job #Jobs #Hiring https://t.co/oekznOTgpQ",want work view latest opening,Sun Aug 27 17:08:42 CDT 2017,"29.7604267,-95.3698028",tmj_hou_nursing,Houston,"Houston, TX","(29.522325,-95.823268),(30.154665,-95.823268),(30.154665,-95.069705),(29.522325,-95.069705),",25,Memorial,,0
901929520051118080,"Bracing beyond #houstonflood #harveystorm #texas #houston #flood #nws #harvey @ Houston, Texas https://t.co/e0WduNbPx9",bracing beyond texas,Sun Aug 27 17:08:49 CDT 2017,"29.7629,-95.3832",MisterAnthonyT,Houston,"Houston, TX","(29.522325,-95.823268),(30.154665,-95.823268),(30.154665,-95.069705),(29.522325,-95.069705),",88,Neartown - Montrose,,0
901929529949659136,Sped up part of my 10 minute FB live so you could see the catastrophic #Houston flooding from… https://t.co/vvi6GcDckV,speed part minute live could see catastrophic flooding,Sun Aug 27 17:08:51 CDT 2017,"29.75799513,-95.36683117",StephanieAbrams,Houston,"Houston, TX","(29.522325,-95.823268),(30.154665,-95.823268),(30.154665,-95.069705),(29.522325,-95.069705),",1,Fourth Ward,,0
901929746543587330,People are escaping on boats to be saved. #Boats are needed to help rescues! More rain expected!… https://t.co/UVjf2CS91b,people escape boat save need help rescue rain expect,Sun Aug 27 17:09:43 CDT 2017,"29.7629,-95.3832",CanduManagement,Houston,"Houston, TX","(29.522325,-95.823268),(30.154665,-95.823268),(30.154665,-95.069705),(29.522325,-95.069705),",30,Downtown,help need people rescue boat,5
901929866282590209,The park is under there somewhere... @ Buffalo Bayou Park https://t.co/HJHZX5hCGN,park somewhere bayou park,Sun Aug 27 17:10:11 CDT 2017,"29.76182363,-95.39310088",golivent1,Houston,"Houston, TX","(29.522325,-95.823268),(30.154665,-95.823268),(30.154665,-95.069705),(29.522325,-95.069705),",1,Fourth Ward,,0
901929919206137856,"Can you recommend anyone for this #job? Application Development Project Manager/Lead - https://t.co/kLgXyRUVpT #IT #Houston, TX #Hiring",recommend anyone application development project managerlead,Sun Aug 27 17:10:24 CDT 2017,"29.7333171,-95.417519",tmj_hou_it,Houston,"Houston, TX","(29.522325,-95.823268),(30.154665,-95.823268),(30.154665,-95.069705),(29.522325,-95.069705),",52,Medical Center Area,,0
901930239894315008,"#Repost @datdamnmonty (get_repost) ・・・ Repost repost @ Houston, Texas https://t.co/SsN0lczCOt",datdamnmonty getrepost repost repost texas,Sun Aug 27 17:11:40 CDT 2017,"29.7629,-95.3832",MrWiredUpOhBoy,Houston,"Houston, TX","(29.522325,-95.823268),(30.154665,-95.823268),(30.154665,-95.069705),(29.522325,-95.069705),",19,Meadowbrook / Allendale,,0
901930410606723073,Keep us in your prayers people. ♡ #houston #htown #Texas #hurricane… https://t.co/XeeOaZnYcV,keep prayer people,Sun Aug 27 17:12:21 CDT 2017,"29.7629,-95.3832",StephAlbaMMA,Houston,"Houston, TX","(29.522325,-95.823268),(30.154665,-95.823268),(30.154665,-95.069705),(29.522325,-95.069705),",30,Downtown,people,1
901930585790263298,Hi dear Ones. Check in before you come by the kitchen tomorrow. Not sure of our hours yet.… https://t.co/jHtps7vKhS,dear one check come kitchen tomorrow sure hours yet,Sun Aug 27 17:13:03 CDT 2017,"29.7557,-95.38701",PatGreerKitchen,Houston,"Houston, TX","(29.522325,-95.823268),(30.154665,-95.823268),(30.154665,-95.069705),(29.522325,-95.069705),",25,Memorial,,0
901930718263222274,"Just posted a video @ Houston, Texas https://t.co/pgVnAspuXY",post video texas,Sun Aug 27 17:13:34 CDT 2017,"29.7629,-95.3832",TheLatinaDiva1,Houston,"Houston, TX","(29.522325,-95.823268),(30.154665,-95.823268),(30.154665,-95.069705),(29.522325,-95.069705),",88,Neartown - Montrose,,0
901930796339965952,And the water just keeps going..... @ Buffalo Bayou Park https://t.co/sg2XHmUBEw,water keep going bayou park,Sun Aug 27 17:13:53 CDT 2017,"29.76182363,-95.39310088",golivent1,Houston,"Houston, TX","(29.522325,-95.823268),(30.154665,-95.823268),(30.154665,-95.069705),(29.522325,-95.069705),",1,Fourth Ward,water,1
901930906054746117,"#Repost @datdamnmonty (get_repost) ・・・ Repost repost it will help @ Houston, Texas https://t.co/lX33CkY3fC",datdamnmonty getrepost repost repost help texas,Sun Aug 27 17:14:19 CDT 2017,"29.7629,-95.3832",MrWiredUpOhBoy,Houston,"Houston, TX","(29.522325,-95.823268),(30.154665,-95.823268),(30.154665,-95.069705),(29.522325,-95.069705),",1,Fourth Ward,help,1
901931128201691136,"Join the fastest growing US retailer: Prestige Beauty Advisor in #Katy, TX - click to apply! https://t.co/VxUXJdblhj #Cosmetology #Job",join fast growing retailer prestige beauty advisor click apply,Sun Aug 27 17:15:12 CDT 2017,"29.7811226,-95.7188834",tmj_hou_cosmo,Houston,"Houston, TX","(29.522325,-95.823268),(30.154665,-95.823268),(30.154665,-95.069705),(29.522325,-95.069705),",1,Fourth Ward,,0
901931266789974016,Can you recommend anyone for this #job? Speech Language Pathologist - Speech & Language Therapy(Days)PRN - https://t.co/CM5LfYAnDl,recommend anyone speech language pathologist speech language therapydaysprn,Sun Aug 27 17:15:45 CDT 2017,"29.7091961,-95.4019527",tmj_hou_health,Houston,"Houston, TX","(29.522325,-95.823268),(30.154665,-95.823268),(30.154665,-95.069705),(29.522325,-95.069705),",30,Downtown,,0
901931425615642625,"Join the 24 Hour Fitness team! See our latest #job opening here: https://t.co/qu7oLg5s9j #customerservice #Houston, TX #Hiring",join hour fitness team see latest opening,Sun Aug 27 17:16:23 CDT 2017,"29.9551726,-95.5364404",tmj_hou_cstsrv,Houston,"Houston, TX","(29.522325,-95.823268),(30.154665,-95.823268),(30.154665,-95.069705),(29.522325,-95.069705),",30,Downtown,,0
901931490761621504,Keeping these girls smiling during #Harvey is a task that this #greatdad is excelling at! We… https://t.co/NN2VGZz4Hc,keeping girl smiling task excel,Sun Aug 27 17:16:39 CDT 2017,"29.98934741,-95.6321496",danitzadar,Houston,"Houston, TX","(29.522325,-95.823268),(30.154665,-95.823268),(30.154665,-95.069705),(29.522325,-95.069705),",47,Trinity / Houston Gardens,,0
901931677743669248,"We're #hiring! Click to apply: Relationship Manager II - Business Banking - North Houston, TX - https://t.co/SkT1rZSoE7 #Banking #Job",click apply relationship manager business banking north houston,Sun Aug 27 17:17:23 CDT 2017,"29.75888,-95.3638571",tmj_hou_banking,Houston,"Houston, TX","(29.522325,-95.823268),(30.154665,-95.823268),(30.154665,-95.069705),(29.522325,-95.069705),",1,Fourth Ward,,0
901931702230159362,Eminem & Busta getting involved then the indictments came down https://t.co/GVC18exBsN,eminem busta getting involve indictment come,Sun Aug 27 17:17:29 CDT 2017,"29.745448,-95.364979",WinkWestwood,Houston,"Houston, TX","(29.522325,-95.823268),(30.154665,-95.823268),(30.154665,-95.069705),(29.522325,-95.069705),",30,Downtown,,0
901931855049400325,"Join the Burns & McDonnell team! See our latest #job opening here: https://t.co/Vc64HVtsmg #Engineering #Houston, TX #Hiring #CareerArc",join burns mcdonnell team see latest opening,Sun Aug 27 17:18:05 CDT 2017,"29.7498112,-95.4571687",tmj_hou_eng,Houston,"Houston, TX","(29.522325,-95.823268),(30.154665,-95.823268),(30.154665,-95.069705),(29.522325,-95.069705),",2,Greater Uptown,,0
901931938998390784,"Can you recommend anyone for this #job in #Houston, TX? https://t.co/HnkFr3Xabk #dental #Assistant #Hiring #CareerArc",recommend anyone,Sun Aug 27 17:18:25 CDT 2017,"29.5642078,-95.0911062",tmj_hou_jobs,Houston,"Houston, TX","(29.522325,-95.823268),(30.154665,-95.823268),(30.154665,-95.069705),(29.522325,-95.069705),",1,Fourth Ward,,0
901932003825782786,They warned us #hurricaneharvey would be bad but I don't think any of us could've imagined this.… https://t.co/1s6nGQwgUw,warn would bad dont think couldve imagine,Sun Aug 27 17:18:41 CDT 2017,"29.7629,-95.3832",imNicholePerez,Houston,"Houston, TX","(29.522325,-95.823268),(30.154665,-95.823268),(30.154665,-95.069705),(29.522325,-95.069705),",1,Fourth Ward,,0
901932268024881153,"Can you recommend anyone for this #job in #Houston, TX? https://t.co/HgWgToYNFq #HR #Hiring #CareerArc",recommend anyone,Sun Aug 27 17:19:44 CDT 2017,"29.7584166,-95.3683008",tmj_hou_hr,Houston,"Houston, TX","(29.522325,-95.823268),(30.154665,-95.823268),(30.154665,-95.069705),(29.522325,-95.069705),",19,Meadowbrook / Allendale,,0
901932682115813376,"See our latest #Houston, TX #job and click to apply: General Manager in Training - Retail - https://t.co/WIiSfNcd9x #Retail #Hiring",see latest click apply general manager training retail,Sun Aug 27 17:21:23 CDT 2017,"29.7901812,-95.3677844",tmj_hou_retail,Houston,"Houston, TX","(29.522325,-95.823268),(30.154665,-95.823268),(30.154665,-95.069705),(29.522325,-95.069705),",1,Fourth Ward,,0
901932724155535360,Uber empty @ Marquis Downtown Lofts https://t.co/dDgfRAbfLr,uber empty downtown loft,Sun Aug 27 17:21:33 CDT 2017,"29.76094,-95.34679",jalhtx,Houston,"Houston, TX","(29.522325,-95.823268),(30.154665,-95.823268),(30.154665,-95.069705),(29.522325,-95.069705),",52,Medical Center Area,,0
901932884306657281,This was literally my sister @richnluv7 car just last year in #Houston. Now it's happening… https://t.co/OOXUZNgODZ,literally sister richnluv car last year happening,Sun Aug 27 17:22:11 CDT 2017,"29.7629,-95.3832",J_R_O_S,Houston,"Houston, TX","(29.522325,-95.823268),(30.154665,-95.823268),(30.154665,-95.069705),(29.522325,-95.069705),",30,Downtown,car,1
901932947162382336,Do you know someone looking for a great #property in #Houston?   #realestate https://t.co/So94DKgdhp https://t.co/4IWCGUp4gx,know someone looking great,Sun Aug 27 17:22:26 CDT 2017,"29.747785,-95.642958",atKWMemorial,Houston,"Houston, TX","(29.522325,-95.823268),(30.154665,-95.823268),(30.154665,-95.069705),(29.522325,-95.069705),",1,Fourth Ward,,0
901933054238838785,😂😂😂😂 RT @papimagnifico: BRUH YALL DID CONOR MCGREGOR WRONG LMFAO https://t.co/HL6mnKRSwP,papimagnifico bruh yall conor mcgregor wrong lmfao,Sun Aug 27 17:22:51 CDT 2017,"29.745817,-95.364954",WinkWestwood,Houston,"Houston, TX","(29.522325,-95.823268),(30.154665,-95.823268),(30.154665,-95.069705),(29.522325,-95.069705),",66,Brays Oaks,,0
901933117975420928,"See our latest #Houston, TX #job and click to apply: Application Support Manager - https://t.co/69oR8ASPpg #CustomerService #Hiring",see latest click apply application support manager,Sun Aug 27 17:23:07 CDT 2017,"29.8673877,-95.593239",tmj_hou_cstsrv,Houston,"Houston, TX","(29.522325,-95.823268),(30.154665,-95.823268),(30.154665,-95.069705),(29.522325,-95.069705),",2,Greater Uptown,support,1
901933357776330752,Hurricanes in hurricane glasses while we wait out the hurricane. #SurvivingHarvey… https://t.co/JORKYOuXnY,hurricane hurricane glasses wait hurricane,Sun Aug 27 17:24:04 CDT 2017,"29.7629,-95.3832",MegAnne,Houston,"Houston, TX","(29.522325,-95.823268),(30.154665,-95.823268),(30.154665,-95.069705),(29.522325,-95.069705),",40,Sharpstown,,0
901933484226183168,"Want to work at Regions Bank? We're #hiring in #Houston, TX! Click for details: https://t.co/8DzLKEsn1A #regions #regionsbank #Finance",want work region bank click details,Sun Aug 27 17:24:34 CDT 2017,"29.7604267,-95.3698028",tmj_hou_finance,Houston,"Houston, TX","(29.522325,-95.823268),(30.154665,-95.823268),(30.154665,-95.069705),(29.522325,-95.069705),",2,Greater Uptown,,0
901933663167713280,We're #hiring! Read about our latest #job opening here: Accenture Analytics-Oil & Gas Data Science Manager - https://t.co/bEFksi4aWJ,read latest opening accenture analyticsoil gas data science manager,Sun Aug 27 17:25:17 CDT 2017,"29.7535357,-95.3657714",tmj_hou_mgmt,Houston,"Houston, TX","(29.522325,-95.823268),(30.154665,-95.823268),(30.154665,-95.069705),(29.522325,-95.069705),",71,Alief,gas,1
901933781669511168,"🙏🙏🙏 @ Greater Hobby, Houston https://t.co/iCI2bRqRLp",hobby houston,Sun Aug 27 17:25:45 CDT 2017,"29.63824042,-95.27901837",joal1969,Houston,"Houston, TX","(29.522325,-95.823268),(30.154665,-95.823268),(30.154665,-95.069705),(29.522325,-95.069705),",2,Greater Uptown,,0
901933894701744129,About 4 miles from me .. please think twice about driving on the streets.  #houston #htown… https://t.co/aubauTV8zl,mile please think twice driving street,Sun Aug 27 17:26:12 CDT 2017,"29.72418314,-95.61990397",bowandarrowent,Houston,"Houston, TX","(29.522325,-95.823268),(30.154665,-95.823268),(30.154665,-95.069705),(29.522325,-95.069705),",2,Greater Uptown,,0
901933981700161536,@wegotthajazz he only had 1 classic imo (Rule 3:36),wegotthajazz classic imo rule,Sun Aug 27 17:26:33 CDT 2017,"29.746668,-95.36519",WinkWestwood,Houston,"Houston, TX","(29.522325,-95.823268),(30.154665,-95.823268),(30.154665,-95.069705),(29.522325,-95.069705),",2,Greater Uptown,,0
901934205902323712,"Can you recommend anyone for this #job? Accounts Payable Clerk - https://t.co/BEm6easWUq #Accounting #Houston, TX #Hiring #CareerArc",recommend anyone account payable clerk,Sun Aug 27 17:27:26 CDT 2017,"29.938885,-95.3991907",tmj_hou_acct,Houston,"Houston, TX","(29.522325,-95.823268),(30.154665,-95.823268),(30.154665,-95.069705),(29.522325,-95.069705),",1,Fourth Ward,,0
901934214894968832,Harvey's wrath continues! At least 15-25 inches more of rain expected by Wednesday. Flooded in… https://t.co/fMfirmCpDQ,harvey wrath continue least inch rain expect wednesday flood,Sun Aug 27 17:27:28 CDT 2017,"29.72913646,-95.58564612",maggiesworld,Houston,"Houston, TX","(29.522325,-95.823268),(30.154665,-95.823268),(30.154665,-95.069705),(29.522325,-95.069705),",22,Mid West,flood,1
901934447125086214,"Can you recommend anyone for this #job in #Houston, TX? https://t.co/LgpD3xmGq8 #Administrative #Hiring",recommend anyone,Sun Aug 27 17:28:23 CDT 2017,"29.7604267,-95.3698028",tmj_hou_cler,Houston,"Houston, TX","(29.522325,-95.823268),(30.154665,-95.823268),(30.154665,-95.069705),(29.522325,-95.069705),",5,Eldridge / West Oaks,,0
901934497729351680,"See our latest #Houston, TX #job and click to apply: Specialist Applications Developer - BI (IA) - https://t.co/z1YzmZUpYk #IT #Hiring",see latest click apply specialist application developer,Sun Aug 27 17:28:36 CDT 2017,"29.8025458,-95.4542613",tmj_HOU_adm,Houston,"Houston, TX","(29.522325,-95.823268),(30.154665,-95.823268),(30.154665,-95.069705),(29.522325,-95.069705),",30,Downtown,,0
901934669553438721,Se incendia vivienda en medio de las inundaciones en #Houston por el #HuracanHarvey… https://t.co/f6OEOdTjzQ,incendia vivienda medio inundaciones por,Sun Aug 27 17:29:17 CDT 2017,"29.7629,-95.3832",DanyCosmoVZLA,Houston,"Houston, TX","(29.522325,-95.823268),(30.154665,-95.823268),(30.154665,-95.069705),(29.522325,-95.069705),",30,Downtown,,0
901934782958903296,"CD's survived the journey through #HurricaneHarvey to Houston, TX!  Shoutout coltmartin45 in HTX… https://t.co/OUgwMm5aVa",survive journey houston shoutout coltmartin htx,Sun Aug 27 17:29:44 CDT 2017,"29.7629,-95.3832",djdiverse,Houston,"Houston, TX","(29.522325,-95.823268),(30.154665,-95.823268),(30.154665,-95.069705),(29.522325,-95.069705),",30,Downtown,,0
901934858242584576,"This is a nursing home in #Houston. It honestly breaks my heart, because I love senior citizens… https://t.co/XPVQ9LNVx0",nursing home honestly break heart love senior citizen,Sun Aug 27 17:30:02 CDT 2017,"29.7629,-95.3832",JordanTisdale_,Houston,"Houston, TX","(29.522325,-95.823268),(30.154665,-95.823268),(30.154665,-95.069705),(29.522325,-95.069705),",6,Washington Avenue Coalition / Memorial Park,home,1
901934989838655488,"Family, here's another check-in ✅! Let me know you're safe! Like this post and comment below,… https://t.co/a5IJ2LIws3",family here another checkin let know youre safe like post comment,Sun Aug 27 17:30:33 CDT 2017,"29.7629,-95.3832",PastorJ_HigherD,Houston,"Houston, TX","(29.522325,-95.823268),(30.154665,-95.823268),(30.154665,-95.069705),(29.522325,-95.069705),",14,Iah / Airport Area,safe family,2
901934993991012352,"See our latest #Webster, TX #job and click to apply: Specialty Beauty Advisor - https://t.co/XsWqR2K2uZ #Cosmetology #Hiring",see latest click apply specialty beauty advisor,Sun Aug 27 17:30:34 CDT 2017,"29.537515,-95.1498529",tmj_hou_cosmo,Houston,"Houston, TX","(29.522325,-95.823268),(30.154665,-95.823268),(30.154665,-95.069705),(29.522325,-95.069705),",5,Eldridge / West Oaks,,0
901935096776671232,"We're #hiring! Click to apply: Shift Supervisor Management Trainee - https://t.co/sUs8WjqBN7 #Labor #Houston, TX #Job #Jobs",click apply shift supervisor management trainee,Sun Aug 27 17:30:58 CDT 2017,"29.7604267,-95.3698028",tmj_hou_labor,Houston,"Houston, TX","(29.522325,-95.823268),(30.154665,-95.823268),(30.154665,-95.069705),(29.522325,-95.069705),",51,Eastex - Jensen Area,,0
901935349835874304,"MONDAY SCHEDULE UPDATE: All classes will be canceled Monday, Aug 28. Even if the rain let's up… https://t.co/GBWtyYEwqw",monday schedule update class cancel monday aug even rain let,Sun Aug 27 17:31:59 CDT 2017,"30.0122923,-95.53684633",OMcherryblossom,Houston,"Houston, TX","(29.522325,-95.823268),(30.154665,-95.823268),(30.154665,-95.069705),(29.522325,-95.069705),",17,South Belt / Ellington,,0
901935472343097345,"We're #hiring! Click to apply: Postdoctoral Fellow - Inflammation & Epigenetics - https://t.co/eaBHpbV1cD #Healthcare #Houston, TX #Job",click apply postdoctoral fellow inflammation epigenetics,Sun Aug 27 17:32:28 CDT 2017,"29.7604267,-95.3698028",tmj_hou_health,Houston,"Houston, TX","(29.522325,-95.823268),(30.154665,-95.823268),(30.154665,-95.069705),(29.522325,-95.069705),",1,Fourth Ward,,0
901935545726623744,#upperlevels #MsBarnett #sbisdfirstday @ Spring Woods High School https://t.co/GzBBnKhLUX,woods high school,Sun Aug 27 17:32:45 CDT 2017,"29.81086,-95.54764",VisualArtsTiger,Houston,"Houston, TX","(29.522325,-95.823268),(30.154665,-95.823268),(30.154665,-95.069705),(29.522325,-95.069705),",56,Hidden Valley,school,1
901935729399414784,"#Trabajo alerta: Kitchen Leader | Zoes Kitchen | #Houston, TX https://t.co/7TOn5Kxw8i #empleo #nowhiring #Hospitalidad #Contratar",alerta kitchen leader zoes kitchen,Sun Aug 27 17:33:29 CDT 2017,"29.7184398,-95.4158174",Zoes_Careers,Houston,"Houston, TX","(29.522325,-95.823268),(30.154665,-95.823268),(30.154665,-95.069705),(29.522325,-95.069705),",59,Fairbanks / Northwest Crossing,,0
901935977496760320,"#USGS08075900 - Greens Bayou nr US Hwy 75 nr Houston, TX Height: 85.13ft ▼ (84.8ft) Flow: 11100cfs https://t.co/f9OZIZu6L0",greens bayou hwy houston height flow,Sun Aug 27 17:34:28 CDT 2017,"29.95688886,-95.4179936",USGS_TexasFlood,Houston,"Houston, TX","(29.522325,-95.823268),(30.154665,-95.823268),(30.154665,-95.069705),(29.522325,-95.069705),",19,Meadowbrook / Allendale,,0
901936013718589441,"Thanks to SCTHouston for Posting this photo of what's going on in Houston right now!!! People,… https://t.co/y2hWve61Gb",thanks scthouston posting photo whats going houston right people,Sun Aug 27 17:34:37 CDT 2017,"29.7629,-95.3832",coopersdadd,Houston,"Houston, TX","(29.522325,-95.823268),(30.154665,-95.823268),(30.154665,-95.069705),(29.522325,-95.069705),",1,Fourth Ward,people,1
901936226369982464,"#USGS08074000 - Buffalo Bayou at Houston, TX Height: 29.23ft ▲ (28ft) Flow: N/Acfs https://t.co/PBJeFjdf42",buffalo bayou houston height flow nacfs,Sun Aug 27 17:35:28 CDT 2017,"29.76022829,-95.4085505",USGS_TexasFlood,Houston,"Houston, TX","(29.522325,-95.823268),(30.154665,-95.823268),(30.154665,-95.069705),(29.522325,-95.069705),",30,Downtown,,0
901936433207771137,"Interested in a #job in #Houston, TX? This could be a great fit: https://t.co/1uPXWkLKZv #Education #Hiring #CareerArc",interest could great fit,Sun Aug 27 17:36:17 CDT 2017,"29.8686695,-95.3633231",tmj_hou_edu,Houston,"Houston, TX","(29.522325,-95.823268),(30.154665,-95.823268),(30.154665,-95.069705),(29.522325,-95.069705),",1,Fourth Ward,,0
901936687206473728,"Want to work at CITI? We're #hiring in #Houston, TX! Click for details: https://t.co/3HdhYWsugj #CitiCareers #InvestmentBanking #Job #Jobs",want work citi click details,Sun Aug 27 17:37:18 CDT 2017,"29.7604267,-95.3698028",tmj_HOU_invbank,Houston,"Houston, TX","(29.522325,-95.823268),(30.154665,-95.823268),(30.154665,-95.069705),(29.522325,-95.069705),",1,Fourth Ward,,0
901936904882446336,"See our latest #Houston, TX #job and click to apply: Surgical Technician III - CV OR (Full Time) - https://t.co/JcUVm8ss68 #Healthcare",see latest click apply surgical technician iii full time,Sun Aug 27 17:38:09 CDT 2017,"29.7604267,-95.3698028",tmj_hou_health,Houston,"Houston, TX","(29.522325,-95.823268),(30.154665,-95.823268),(30.154665,-95.069705),(29.522325,-95.069705),",7,Pleasantville Area,,0
901937015280648192,"We're #hiring! Click to apply: Release Of Information Account Specialist - https://t.co/WlCGfFYZso #Clerical #Houston, TX #Job #Jobs",click apply release information account specialist,Sun Aug 27 17:38:36 CDT 2017,"29.7604267,-95.3698028",tmj_hou_cler,Houston,"Houston, TX","(29.522325,-95.823268),(30.154665,-95.823268),(30.154665,-95.069705),(29.522325,-95.069705),",72,Pecan Park,,0
901937147686428672,"Can you recommend anyone for this #job in #Houston, TX? https://t.co/zW0CNeboed #Professional #Hiring",recommend anyone,Sun Aug 27 17:39:07 CDT 2017,"29.7604267,-95.3698028",tmj_hou_mgmt,Houston,"Houston, TX","(29.522325,-95.823268),(30.154665,-95.823268),(30.154665,-95.069705),(29.522325,-95.069705),",18,Ost / South Union,,0
901937339135602688,Tequila makes things better #hurricaneharvey #hurricaneharvey2017 #hurrication #historicflooding… https://t.co/EHmDbCdtKG,tequila make things better,Sun Aug 27 17:39:53 CDT 2017,"29.7731998,-95.37698341",miamundy,Houston,"Houston, TX","(29.522325,-95.823268),(30.154665,-95.823268),(30.154665,-95.069705),(29.522325,-95.069705),",30,Downtown,,0
901937444894867456,"Can you recommend anyone for this #job in #Houston, TX? https://t.co/PWQkTqgVgL #saleslife #sales #Hiring",recommend anyone,Sun Aug 27 17:40:18 CDT 2017,"29.7377362,-95.4776542",tmj_hou_sales,Houston,"Houston, TX","(29.522325,-95.823268),(30.154665,-95.823268),(30.154665,-95.069705),(29.522325,-95.069705),",13,Greater Greenspoint,,0
901937674377773061,Good morning again!!! ☀😉 We meet 16 sunrises a day and this is one of today's.  #iss… https://t.co/0XaZDlJ7kE,good morning meet sunrise day one today,Sun Aug 27 17:41:13 CDT 2017,"29.5517727,-95.09765115",Space3Universe,Houston,"Houston, TX","(29.522325,-95.823268),(30.154665,-95.823268),(30.154665,-95.069705),(29.522325,-95.069705),",49,Carverdale,,0
901937729046331392,"This #job might be a great fit for you: Senior HVAC Repairer - https://t.co/TUGlH6zPkz #FacilitiesMgmt #Houston, TX #Hiring #CareerArc",might great fit senior hvac repairer,Sun Aug 27 17:41:26 CDT 2017,"29.8025458,-95.4542613",tmj_TX_facmgmt,Houston,"Houston, TX","(29.522325,-95.823268),(30.154665,-95.823268),(30.154665,-95.069705),(29.522325,-95.069705),",2,Greater Uptown,,0
901938039114649601,"Just finished watching a movie, trying to not blow through all of my data in 3 days, so I'm… https://t.co/JFhg8PbNBy",finish watching movie try blow data days,Sun Aug 27 17:42:40 CDT 2017,"29.82940311,-95.44534845",Miss_LilithDay,Houston,"Houston, TX","(29.522325,-95.823268),(30.154665,-95.823268),(30.154665,-95.069705),(29.522325,-95.069705),",2,Greater Uptown,,0
901938231838556160,"See our latest #Houston, TX #job and click to apply: Staff Electrical Engineer - https://t.co/4ELzN1HtXY #engineering #Hiring",see latest click apply staff electrical engineer,Sun Aug 27 17:43:26 CDT 2017,"29.7498112,-95.4571687",tmj_hou_eng,Houston,"Houston, TX","(29.522325,-95.823268),(30.154665,-95.823268),(30.154665,-95.069705),(29.522325,-95.069705),",60,Gulfton,,0
901938259684716547,"¡Oremos por nuestra ciudad mi gente, y por todos los lugares y personas afectadas por el Huracán… https://t.co/orxmSDU7LI",oremos por nuestra ciudad gente por todos los lugares persona afectadas por huracn,Sun Aug 27 17:43:32 CDT 2017,"29.7629,-95.3832",eltravieso001,Houston,"Houston, TX","(29.522325,-95.823268),(30.154665,-95.823268),(30.154665,-95.069705),(29.522325,-95.069705),",17,South Belt / Ellington,,0
