902186338656464896,"If you're looking for work in #Houston, TX, check out this #job: https://t.co/yqspOmLAv1 #businessdevelopment #bizdev #Hiring",youre looking work check,Mon Aug 28 10:09:19 CDT 2017,"29.7462182,-95.559588",ZurichNACareers,Houston,"Houston, TX","(29.522325,-95.823268),(30.154665,-95.823268),(30.154665,-95.069705),(29.522325,-95.069705),",36,Lazy Brook / Timbergrove,,0
902186435880595457,Highway 59/69 at downtown Houston. Just wow. Waze app tried to get me in there 😨😜. So many… https://t.co/GsYD1xmIvJ,highway downtown houston wow waze app try get many,Mon Aug 28 10:09:42 CDT 2017,"29.75799513,-95.36683117",highspeedphoto,Houston,"Houston, TX","(29.522325,-95.823268),(30.154665,-95.823268),(30.154665,-95.069705),(29.522325,-95.069705),",30,Downtown,,0
902186643234443264,I'm At #fiesta In #3rdward on Wheeler They Only Letting 5 People In At A Time But They Open If… https://t.co/QswB0YMS8V,wheeler letting people time open,Mon Aug 28 10:10:32 CDT 2017,"29.73,-95.36",McQua,Houston,"Houston, TX","(29.522325,-95.823268),(30.154665,-95.823268),(30.154665,-95.069705),(29.522325,-95.069705),",58,Willowbrook,people,1
902186739976024064,SIENNA PLANTATION ALERT MANDATORY EVACUATION AND OFFICIAL RELEASE:   At the request of the… https://t.co/ecdwLR80ep,sienna plantation alert mandatory evacuation official release request,Mon Aug 28 10:10:55 CDT 2017,"29.7629,-95.3832",isiahcareyFOX26,Houston,"Houston, TX","(29.522325,-95.823268),(30.154665,-95.823268),(30.154665,-95.069705),(29.522325,-95.069705),",1,Fourth Ward,,0
902186755234840576,"Join the Houston Independent School District team! See our latest #job opening here: https://t.co/m35lWMAW72 #Transportation #Houston, TX",join houston independent school district team see latest opening,Mon Aug 28 10:10:58 CDT 2017,"29.8025458,-95.4542613",tmj_hou_transp,Houston,"Houston, TX","(29.522325,-95.823268),(30.154665,-95.823268),(30.154665,-95.069705),(29.522325,-95.069705),",19,Meadowbrook / Allendale,school,1
902186843705229313,The silver lining of this trip cut short is that we didn't get caught in a flood. #wyndham… https://t.co/oHo6unsIdD,silver lining trip cut short didnt get catch flood,Mon Aug 28 10:11:20 CDT 2017,"29.7629,-95.3832",taynoplay,Houston,"Houston, TX","(29.522325,-95.823268),(30.154665,-95.823268),(30.154665,-95.069705),(29.522325,-95.069705),",30,Downtown,flood,1
902186882129289216,"Can you recommend anyone for this #job? Sr. Engineer - https://t.co/J0iJMfwQfc #Engineering #Houston, TX #Hiring #CareerArc",recommend anyone engineer,Mon Aug 28 10:11:29 CDT 2017,"29.716821,-95.50369",tmj_hou_eng,Houston,"Houston, TX","(29.522325,-95.823268),(30.154665,-95.823268),(30.154665,-95.069705),(29.522325,-95.069705),",19,Meadowbrook / Allendale,,0
902187213940678656,This is and much worse is what we're dealing with in Houston right now. #houston #hurricane… https://t.co/3wQAHpa5CH,much worse dealing houston right,Mon Aug 28 10:12:48 CDT 2017,"29.76182363,-95.39310088",thegreekmikeb,Houston,"Houston, TX","(29.522325,-95.823268),(30.154665,-95.823268),(30.154665,-95.069705),(29.522325,-95.069705),",1,Fourth Ward,,0
902187330626248704,"‼️‼️‼️SHELTER ALERT‼️‼️‼️ #Repost wvchurchfamily ・・・ Beginning at 9:00 a.m. today, The Kingdom… https://t.co/xmnzrW1yCd",shelter alert wvchurchfamily beginning today kingdom,Mon Aug 28 10:13:16 CDT 2017,"29.62528509,-95.4713816",RonaldCGreen,Houston,"Houston, TX","(29.522325,-95.823268),(30.154665,-95.823268),(30.154665,-95.069705),(29.522325,-95.069705),",30,Downtown,shelter,1
902187361769058307,"#Repost @MrSockGame ・・・ #Hurricaneharvey @ Houston, Texas https://t.co/GTlkPlfR0S",mrsockgame texas,Mon Aug 28 10:13:23 CDT 2017,"29.7629,-95.3832",DjRed_ScrewedUp,Houston,"Houston, TX","(29.522325,-95.823268),(30.154665,-95.823268),(30.154665,-95.069705),(29.522325,-95.069705),",84,Meyerland Area,,0
902187419239370754,"Contact Fam @b_woods4 ‼️‼️#hurricaneharvey #houston @ Houston, Texas https://t.co/gKrXzZAAL1",contact fam bwoods texas,Mon Aug 28 10:13:37 CDT 2017,"29.7629,-95.3832",DessiiWorld,Houston,"Houston, TX","(29.522325,-95.823268),(30.154665,-95.823268),(30.154665,-95.069705),(29.522325,-95.069705),",30,Downtown,contact,1
902187462843260929,"Want to work at Cognizant? We're #hiring in #Houston, TX! Click for details: https://t.co/W3o4bY3SPW #IT #Job #Jobs",want work cognizant click details,Mon Aug 28 10:13:47 CDT 2017,"29.7604267,-95.3698028",USJobsCognizant,Houston,"Houston, TX","(29.522325,-95.823268),(30.154665,-95.823268),(30.154665,-95.069705),(29.522325,-95.069705),",1,Fourth Ward,,0
902187615247589376,This is Lake Beltway. Kayak Toll Fee is $.75 | This is my… https://t.co/xm00bPPzvZ,lake beltway kayak toll fee,Mon Aug 28 10:14:23 CDT 2017,"29.7629,-95.3832",JRCohen,Houston,"Houston, TX","(29.522325,-95.823268),(30.154665,-95.823268),(30.154665,-95.069705),(29.522325,-95.069705),",1,Fourth Ward,,0
902187761284866049,"#Repost @ Houston, Texas https://t.co/vAFDtd98ZA",texas,Mon Aug 28 10:14:58 CDT 2017,"29.7629,-95.3832",DjRed_ScrewedUp,Houston,"Houston, TX","(29.522325,-95.823268),(30.154665,-95.823268),(30.154665,-95.069705),(29.522325,-95.069705),",30,Downtown,,0
902188005364027393,"#Repost 979thebox ・・・ Share 🙏🏽 @ Houston, Texas https://t.co/ogNjMWLFA8",thebox share texas,Mon Aug 28 10:15:56 CDT 2017,"29.7629,-95.3832",DjRed_ScrewedUp,Houston,"Houston, TX","(29.522325,-95.823268),(30.154665,-95.823268),(30.154665,-95.069705),(29.522325,-95.069705),",62,Macgregor,,0
902188042873696256,"Houston, I love you. @ Houston, Texas https://t.co/iZ1fmShZQd",houston love texas,Mon Aug 28 10:16:05 CDT 2017,"29.7629,-95.3832",nicolemijaa,Houston,"Houston, TX","(29.522325,-95.823268),(30.154665,-95.823268),(30.154665,-95.069705),(29.522325,-95.069705),",30,Downtown,,0
902188251179569154,"#Repost 979thebox ・・・ Sienna Plantation upgraded to mandatory evacuation 🙏🏽 @ Houston, Texas https://t.co/8xDKqHGKWX",thebox sienna plantation upgrade mandatory evacuation texas,Mon Aug 28 10:16:55 CDT 2017,"29.7629,-95.3832",DjRed_ScrewedUp,Houston,"Houston, TX","(29.522325,-95.823268),(30.154665,-95.823268),(30.154665,-95.069705),(29.522325,-95.069705),",1,Fourth Ward,,0
902188470445019137,"If you're looking for work in #Houston, TX, check out this #job: https://t.co/eEypiXVBO9 #careers #hiring #Frontofhouse #Lead #CareerArc",youre looking work check,Mon Aug 28 10:17:47 CDT 2017,"29.7549739,-95.3626405",SnapKitchenJobs,Houston,"Houston, TX","(29.522325,-95.823268),(30.154665,-95.823268),(30.154665,-95.069705),(29.522325,-95.069705),",30,Downtown,,0
902188495560740866,"""Life isn't about waiting for the storm ⛈ to pass, it's about learning to dance 💃 in the ☔️!""💋… https://t.co/iLR7icmjo8",life isnt waiting storm pass learning dance,Mon Aug 28 10:17:53 CDT 2017,"29.7629,-95.3832",vdarnelthomas,Houston,"Houston, TX","(29.522325,-95.823268),(30.154665,-95.823268),(30.154665,-95.069705),(29.522325,-95.069705),",1,Fourth Ward,,0
902188687802351616,"Can you recommend anyone for this #job? Teaching Assistant - 10 M - https://t.co/bUYt6HmIuz #Education #Houston, TX #Hiring #CareerArc",recommend anyone teaching assistant,Mon Aug 28 10:18:39 CDT 2017,"29.6753129,-95.5039161",tmj_hou_edu,Houston,"Houston, TX","(29.522325,-95.823268),(30.154665,-95.823268),(30.154665,-95.069705),(29.522325,-95.069705),",2,Greater Uptown,,0
902188811404402688,"""Life isn't about waiting for the storm ⛈ to pass, it's about learning to dance 💃 in the ☔️!""💋… https://t.co/2mWfJqASol",life isnt waiting storm pass learning dance,Mon Aug 28 10:19:09 CDT 2017,"29.7629,-95.3832",vdarnelthomas,Houston,"Houston, TX","(29.522325,-95.823268),(30.154665,-95.823268),(30.154665,-95.069705),(29.522325,-95.069705),",62,Macgregor,,0
902188942149115904,"Join the fastest growing US retailer: Prestige Beauty Advisor in #Webster, TX - click to apply! https://t.co/zirHlDp0Dn #Cosmetology #Job",join fast growing retailer prestige beauty advisor click apply,Mon Aug 28 10:19:40 CDT 2017,"29.537515,-95.1498529",tmj_hou_cosmo,Houston,"Houston, TX","(29.522325,-95.823268),(30.154665,-95.823268),(30.154665,-95.069705),(29.522325,-95.069705),",52,Medical Center Area,,0
902189058037649410,"Interested in a #job in #Houston, TX? This could be a great fit: https://t.co/CijNA1YPqS #Nursing #Hiring #CareerArc",interest could great fit,Mon Aug 28 10:20:07 CDT 2017,"29.7091961,-95.4019527",tmj_hou_nursing,Houston,"Houston, TX","(29.522325,-95.823268),(30.154665,-95.823268),(30.154665,-95.069705),(29.522325,-95.069705),",30,Downtown,,0
902189199931174912,S/o @kevinhart4real for starting tha #HurricaneHarveyChallenge #prayforhouston #prayforTexas… https://t.co/047LftRx0m,kevinhartreal starting tha,Mon Aug 28 10:20:41 CDT 2017,"29.7629,-95.3832",hank_da_tank357,Houston,"Houston, TX","(29.522325,-95.823268),(30.154665,-95.823268),(30.154665,-95.069705),(29.522325,-95.069705),",37,Greater Heights,,0
902189334517780480,"Join the Enterprise Products team! See our latest #job opening here: https://t.co/sLMSwPuhkm #energy #Sales #Houston, TX #Hiring",join enterprise product team see latest opening,Mon Aug 28 10:21:13 CDT 2017,"29.7604267,-95.3698028",EProd_Careers,Houston,"Houston, TX","(29.522325,-95.823268),(30.154665,-95.823268),(30.154665,-95.069705),(29.522325,-95.069705),",2,Greater Uptown,,0
902189363416756225,"Praying #🙏🏾 -- #houston #prayers #blessing #help #🙏🏾 @ Houston, Texas https://t.co/4MxL8N7cxy",pray texas,Mon Aug 28 10:21:20 CDT 2017,"29.7629,-95.3832",ChrisdellHarris,Houston,"Houston, TX","(29.522325,-95.823268),(30.154665,-95.823268),(30.154665,-95.069705),(29.522325,-95.069705),",1,Fourth Ward,,0
902189374741385218,"""Harvey, you're one son of a gun. Feeling powerless with y'all in this storm. Gratefully… https://t.co/L14ilM6TBe",harvey youre one son gun feeling powerless yall storm gratefully,Mon Aug 28 10:21:23 CDT 2017,"29.75799513,-95.36683117",LARArtStudio,Houston,"Houston, TX","(29.522325,-95.823268),(30.154665,-95.823268),(30.154665,-95.069705),(29.522325,-95.069705),",30,Downtown,,0
902189599581061120,Our thoughts are with those of you that have been effected by Hurricane Harvey which has caused… https://t.co/0URK3Gg8Gt,thought effect hurricane harvey cause,Mon Aug 28 10:22:17 CDT 2017,"29.7629,-95.3832",USJETTING1991,Houston,"Houston, TX","(29.522325,-95.823268),(30.154665,-95.823268),(30.154665,-95.069705),(29.522325,-95.069705),",30,Downtown,,0
902189627880071168,"Want to work in #Houston, TX? View our latest opening: #hiring #career https://t.co/z7AYxbcYMH",want work view latest opening,Mon Aug 28 10:22:23 CDT 2017,"29.6313081,-95.2608457",tmj_hou_manuf,Houston,"Houston, TX","(29.522325,-95.823268),(30.154665,-95.823268),(30.154665,-95.069705),(29.522325,-95.069705),",23,Midtown,,0
902189996282482689,"Interested in a #job in #Houston, TX? This could be a great fit: https://t.co/c9CdY0QVQg #Administrative #Hiring",interest could great fit,Mon Aug 28 10:23:51 CDT 2017,"29.7604267,-95.3698028",tmj_hou_cler,Houston,"Houston, TX","(29.522325,-95.823268),(30.154665,-95.823268),(30.154665,-95.069705),(29.522325,-95.069705),",5,Eldridge / West Oaks,,0
902190099252826112,Just hanging out watching Moana and petting our kitty during the… https://t.co/xFYlDK0GnE,hanging watching moana petting kitty,Mon Aug 28 10:24:16 CDT 2017,"29.7629,-95.3832",carolinewnorman,Houston,"Houston, TX","(29.522325,-95.823268),(30.154665,-95.823268),(30.154665,-95.069705),(29.522325,-95.069705),",2,Greater Uptown,,0
902190200817938434,Why I just read that in Ross voice lmaooo,read ross voice lmaooo,Mon Aug 28 10:24:40 CDT 2017,"29.63963964,-95.50563573",_ClutchCity,Houston,"Houston, TX","(29.522325,-95.823268),(30.154665,-95.823268),(30.154665,-95.069705),(29.522325,-95.069705),",27,Addicks Park Ten,,0
902190215954968576,"🙏🙏🙏 @ Houston, Texas https://t.co/1jaHPplCBH",texas,Mon Aug 28 10:24:44 CDT 2017,"29.7629,-95.3832",joal1969,Houston,"Houston, TX","(29.522325,-95.823268),(30.154665,-95.823268),(30.154665,-95.069705),(29.522325,-95.069705),",30,Downtown,,0
902190448592039936,Some areas in Missouri City and Sugarland are now under mandatory evacuation orders. Please… https://t.co/8tgXFddrG2,area missouri city sugarland mandatory evacuation order please,Mon Aug 28 10:25:39 CDT 2017,"29.7629,-95.3832",DiceyGrenor,Houston,"Houston, TX","(29.522325,-95.823268),(30.154665,-95.823268),(30.154665,-95.069705),(29.522325,-95.069705),",40,Sharpstown,,0
902190479789445120,‼️‼️‼️VOLUNTEER OPPORTUNITIES‼️‼️‼️ #Repost @chrisb_brown ・・・ If you'd like to volunteer during… https://t.co/mmgv0VlIOF,volunteer opportunity chrisbbrown youd like volunteer,Mon Aug 28 10:25:46 CDT 2017,"29.7629,-95.3832",RonaldCGreen,Houston,"Houston, TX","(29.522325,-95.823268),(30.154665,-95.823268),(30.154665,-95.069705),(29.522325,-95.069705),",30,Downtown,volunteer,1
902190509506088961,"Lord, we need You now! Please stop the rain from coming, in… https://t.co/LVW17LUkVX",lord need please stop rain coming,Mon Aug 28 10:25:54 CDT 2017,"29.7629,-95.3832",chellsettle,Houston,"Houston, TX","(29.522325,-95.823268),(30.154665,-95.823268),(30.154665,-95.069705),(29.522325,-95.069705),",55,Northside/Northline,need,1
902190569010601984,"If you're looking for work in #Houston, TX, check out this #job: https://t.co/gjGakUctKH #IT #Hiring #CareerArc",youre looking work check,Mon Aug 28 10:26:08 CDT 2017,"29.75888,-95.3638571",tmj_HOU_adm,Houston,"Houston, TX","(29.522325,-95.823268),(30.154665,-95.823268),(30.154665,-95.069705),(29.522325,-95.069705),",88,Neartown - Montrose,,0
902190581400485888,"Can you recommend anyone for this #job? Store Team Member - https://t.co/q2sHgquyWj #Houston, TX #Hiring",recommend anyone store team member,Mon Aug 28 10:26:11 CDT 2017,"29.7604267,-95.3698028",tmj_hou_jobs,Houston,"Houston, TX","(29.522325,-95.823268),(30.154665,-95.823268),(30.154665,-95.069705),(29.522325,-95.069705),",52,Medical Center Area,store,1
902190745020276736,"See our latest #Houston, TX #job and click to apply: Warehouse Supervisor - https://t.co/bK2QyP6poA #FacilitiesMgmt #Hiring",see latest click apply warehouse supervisor,Mon Aug 28 10:26:50 CDT 2017,"29.77,-95.37",tmj_TX_facmgmt,Houston,"Houston, TX","(29.522325,-95.823268),(30.154665,-95.823268),(30.154665,-95.069705),(29.522325,-95.069705),",30,Downtown,,0
902190881150816256,"#aircomwireless in east mount Houston,  got hit up by some looters. Anybody know the owners… https://t.co/Z8GaynSxRP",east mount houston get hit looter anybody know owner,Mon Aug 28 10:27:22 CDT 2017,"29.8908,-95.3056",WallaceCarranza,Houston,"Houston, TX","(29.522325,-95.823268),(30.154665,-95.823268),(30.154665,-95.069705),(29.522325,-95.069705),",5,Eldridge / West Oaks,,0
902190929053810689,"Join the City of Houston team! See our latest #job opening here: https://t.co/Ht1Gz8cjvj #SkilledTrade #Houston, TX #Hiring #CareerArc",join city houston team see latest opening,Mon Aug 28 10:27:34 CDT 2017,"29.7604267,-95.3698028",tmj_HOU_skltrd,Houston,"Houston, TX","(29.522325,-95.823268),(30.154665,-95.823268),(30.154665,-95.069705),(29.522325,-95.069705),",2,Greater Uptown,,0
902190964625821699,"#Repost @calisha__ (get_repost) @ Westside, Houston, Texas https://t.co/OVNo8GaVft",calisha getrepost houston texas,Mon Aug 28 10:27:42 CDT 2017,"29.72418314,-95.61990397",GreedyMussolini,Houston,"Houston, TX","(29.522325,-95.823268),(30.154665,-95.823268),(30.154665,-95.069705),(29.522325,-95.069705),",30,Downtown,,0
902191265738928128,"This #job might be a great fit for you: Store Team Member - https://t.co/M3ZsDPO29V #Labor #Houston, TX #Hiring",might great fit store team member,Mon Aug 28 10:28:54 CDT 2017,"29.7604267,-95.3698028",tmj_hou_labor,Houston,"Houston, TX","(29.522325,-95.823268),(30.154665,-95.823268),(30.154665,-95.069705),(29.522325,-95.069705),",58,Willowbrook,store,1
902191579582136321,"#Repost @ Houston, Texas https://t.co/HkXHduIOLR",texas,Mon Aug 28 10:30:09 CDT 2017,"29.7629,-95.3832",DjRed_ScrewedUp,Houston,"Houston, TX","(29.522325,-95.823268),(30.154665,-95.823268),(30.154665,-95.069705),(29.522325,-95.069705),",1,Fourth Ward,,0
902191754559889408,"This #job might be a great fit for you: Retail Marketing Manager - https://t.co/Hvwb4xjaqz #Marketing #Houston, TX #Hiring #CareerArc",might great fit retail marketing manager,Mon Aug 28 10:30:50 CDT 2017,"29.7331398,-95.4354701",tmj_hou_adv,Houston,"Houston, TX","(29.522325,-95.823268),(30.154665,-95.823268),(30.154665,-95.069705),(29.522325,-95.069705),",30,Downtown,,0
902191824693075968,#HurricaneHarvey got my whole blocked flooded #prayforHouston @abc #prayforTexas… https://t.co/MeAdEtBvJU,get whole block flood abc,Mon Aug 28 10:31:07 CDT 2017,"29.718886,-95.6073999",hank_da_tank357,Houston,"Houston, TX","(29.522325,-95.823268),(30.154665,-95.823268),(30.154665,-95.069705),(29.522325,-95.069705),",2,Greater Uptown,flood,1
902191892972027904,"Can you recommend anyone for this #job? Cloud / Java Architect - VP - https://t.co/ClVjo8SyTX #IT #Houston, TX #Hiring #CareerArc",recommend anyone cloud java architect,Mon Aug 28 10:31:23 CDT 2017,"29.75888,-95.3638571",tmj_hou_it,Houston,"Houston, TX","(29.522325,-95.823268),(30.154665,-95.823268),(30.154665,-95.069705),(29.522325,-95.069705),",1,Fourth Ward,,0
902191997271736322,"As shared by our Pastor this morning during 15 @7, it's imperative that we do not lose our faith… https://t.co/gtud8r2bMC",share pastor morning imperative lose faith,Mon Aug 28 10:31:48 CDT 2017,"29.7629,-95.3832",higherdchurch,Houston,"Houston, TX","(29.522325,-95.823268),(30.154665,-95.823268),(30.154665,-95.069705),(29.522325,-95.069705),",36,Lazy Brook / Timbergrove,,0
902192051009224704,My optimism from last night has left. #yesitsrainingagain #goawayharvey #hurricaneharvey… https://t.co/4Xd0S5wa5H,optimism last night left,Mon Aug 28 10:32:01 CDT 2017,"29.7811,-95.5459",TaraNMay,Houston,"Houston, TX","(29.522325,-95.823268),(30.154665,-95.823268),(30.154665,-95.069705),(29.522325,-95.069705),",1,Fourth Ward,,0
902192197336010757,Praying for a return to a beautiful and sunshine-filled room. #hurricaneharvey has us all… https://t.co/m6F4TjOJaf,pray return beautiful sunshinefilled room,Mon Aug 28 10:32:36 CDT 2017,"29.7629,-95.3832",cindylynnben,Houston,"Houston, TX","(29.522325,-95.823268),(30.154665,-95.823268),(30.154665,-95.069705),(29.522325,-95.069705),",30,Downtown,,0
902192439213125633,Canyon Navy is in Houston to help rescue. Download this zello app to coordinate a rescue.… https://t.co/icEcFLOYkr,canyon navy houston help rescue download zello app coordinate rescue,Mon Aug 28 10:33:34 CDT 2017,"29.7629,-95.3832",DiceyGrenor,Houston,"Houston, TX","(29.522325,-95.823268),(30.154665,-95.823268),(30.154665,-95.069705),(29.522325,-95.069705),",1,Fourth Ward,help rescue,2
902192491218305025,"Just posted a photo @ Alief, Houston https://t.co/sU12ZDguYq",post photo houston,Mon Aug 28 10:33:46 CDT 2017,"29.71111111,-95.59638889",iROCK_POLOnJAYS,Houston,"Houston, TX","(29.522325,-95.823268),(30.154665,-95.823268),(30.154665,-95.069705),(29.522325,-95.069705),",30,Downtown,,0
902192560508067840,We're #hiring! Read about our latest #job opening here: Speech Therapy Assistant (multiple positions) - https://t.co/008xTGF8gq #Education,read latest opening speech therapy assistant multiple position,Mon Aug 28 10:34:03 CDT 2017,"29.8025458,-95.4542613",tmj_hou_edu,Houston,"Houston, TX","(29.522325,-95.823268),(30.154665,-95.823268),(30.154665,-95.069705),(29.522325,-95.069705),",1,Fourth Ward,,0
902192707682041856,"#Repost @ Houston, Texas https://t.co/SRDf5RMZGJ",texas,Mon Aug 28 10:34:38 CDT 2017,"29.7629,-95.3832",DjRed_ScrewedUp,Houston,"Houston, TX","(29.522325,-95.823268),(30.154665,-95.823268),(30.154665,-95.069705),(29.522325,-95.069705),",62,Macgregor,,0
902192797536591876,"If you're looking for work in #Houston, TX, check out this #job: https://t.co/GA8b6x8YRH #FacilitiesMgmt #Hiring #CareerArc",youre looking work check,Mon Aug 28 10:34:59 CDT 2017,"29.6822289,-95.5569074",tmj_TX_facmgmt,Houston,"Houston, TX","(29.522325,-95.823268),(30.154665,-95.823268),(30.154665,-95.069705),(29.522325,-95.069705),",2,Greater Uptown,,0
902192961256955909,I am looking for a buyer on 1207 Creekside Acres CT #Houston #TX  #realestate https://t.co/XF17cFJAFF https://t.co/xQxyOfIKz0,looking buyer creekside acres,Mon Aug 28 10:35:38 CDT 2017,"29.888231,-95.5446675",iChooseJared,Houston,"Houston, TX","(29.522325,-95.823268),(30.154665,-95.823268),(30.154665,-95.069705),(29.522325,-95.069705),",30,Downtown,,0
902193024783982592,Just posted a video @ La Casa Del Dannyboy https://t.co/3XrOgncRwq,post video casa del dannyboy,Mon Aug 28 10:35:53 CDT 2017,"29.6795207,-95.2314663",Dannyboy1112,Houston,"Houston, TX","(29.522325,-95.823268),(30.154665,-95.823268),(30.154665,-95.069705),(29.522325,-95.069705),",30,Downtown,,0
902193300639178753,"Although I'm stuck where I am, once this storm pass please let me know what volunteering work I… https://t.co/E51aSUx7bR",although stick storm pass please let know volunteer work,Mon Aug 28 10:36:59 CDT 2017,"29.7629,-95.3832",ervacarter,Houston,"Houston, TX","(29.522325,-95.823268),(30.154665,-95.823268),(30.154665,-95.069705),(29.522325,-95.069705),",88,Neartown - Montrose,volunteer,1
902193355366440960,"We're #hiring! Read about our latest #job opening here: Senior Pipeline Engineer - https://t.co/bwAM01Xb8X #Engineering #Houston, TX",read latest opening senior pipeline engineer,Mon Aug 28 10:37:12 CDT 2017,"29.7498112,-95.4571687",tmj_hou_eng,Houston,"Houston, TX","(29.522325,-95.823268),(30.154665,-95.823268),(30.154665,-95.069705),(29.522325,-95.069705),",30,Downtown,,0
902193409133182977,"Can you recommend anyone for this #job in #Houston, TX? https://t.co/YwvxALnszc #CustomerService #Hiring #CareerArc",recommend anyone,Mon Aug 28 10:37:25 CDT 2017,"29.7604267,-95.3698028",HouJobs,Houston,"Houston, TX","(29.522325,-95.823268),(30.154665,-95.823268),(30.154665,-95.069705),(29.522325,-95.069705),",45,Willow Meadows / Willowbend Area,,0
902193430092238848,"troubleman31 💯🤘🏽 @ Houston, Texas https://t.co/mhmUHYhQdj",troubleman texas,Mon Aug 28 10:37:30 CDT 2017,"29.7629,-95.3832",djbuddhaTX,Houston,"Houston, TX","(29.522325,-95.823268),(30.154665,-95.823268),(30.154665,-95.069705),(29.522325,-95.069705),",30,Downtown,,0
902193652855799808,"Join the JP Morgan Chase team! See our latest #job opening here: https://t.co/bat2V0AMeV #IT #Houston, TX #Hiring #CareerArc",join morgan chase team see latest opening,Mon Aug 28 10:38:23 CDT 2017,"29.75888,-95.3638571",tmj_HOU_adm,Houston,"Houston, TX","(29.522325,-95.823268),(30.154665,-95.823268),(30.154665,-95.069705),(29.522325,-95.069705),",33,Golfcrest / Bellfort / Reveille,,0
902193703220985857,"Can you recommend anyone for this #job? Wellness Coordinator - https://t.co/KrAbnYFxjY #HR #Houston, TX #Hiring #CareerArc",recommend anyone wellness coordinator,Mon Aug 28 10:38:35 CDT 2017,"29.7499878,-95.3709338",tmj_hou_hr,Houston,"Houston, TX","(29.522325,-95.823268),(30.154665,-95.823268),(30.154665,-95.069705),(29.522325,-95.069705),",1,Fourth Ward,,0
902193832158052352,#HurricanHarvey: #Repost @shortstopmane (get_repost) ・・・ ANYTHING HELPS 🙏🏾#sos #saveoursouls… https://t.co/6XmN3rs1Md,shortstopmane getrepost anything help,Mon Aug 28 10:39:06 CDT 2017,"29.7629,-95.3832",thedijitaldj,Houston,"Houston, TX","(29.522325,-95.823268),(30.154665,-95.823268),(30.154665,-95.069705),(29.522325,-95.069705),",73,Clear Lake,help,1
902193899107528704,"We're #hiring! Click to apply: Travel CT Rad Tech - https://t.co/cSiKc423zT #Healthcare #Houston, TX #Job #Jobs",click apply travel rad tech,Mon Aug 28 10:39:22 CDT 2017,"29.6849782,-95.3991907",tmj_hou_health,Houston,"Houston, TX","(29.522325,-95.823268),(30.154665,-95.823268),(30.154665,-95.069705),(29.522325,-95.069705),",52,Medical Center Area,,0
902194004250550273,Just posted a video @ La Casa Del Dannyboy https://t.co/Nd4BvZNHx2,post video casa del dannyboy,Mon Aug 28 10:39:47 CDT 2017,"29.6795207,-95.2314663",Dannyboy1112,Houston,"Houston, TX","(29.522325,-95.823268),(30.154665,-95.823268),(30.154665,-95.069705),(29.522325,-95.069705),",2,Greater Uptown,,0
902194075767627776,My optimism from last night has vanished. #yesitsstillraining #goawayharvey #hurricaneharvey… https://t.co/pY4YikI9OE,optimism last night vanish,Mon Aug 28 10:40:04 CDT 2017,"29.7811,-95.5459",TaraNMay,Houston,"Houston, TX","(29.522325,-95.823268),(30.154665,-95.823268),(30.154665,-95.069705),(29.522325,-95.069705),",70,Westchase,,0
902194198211911680,Continuing to get folks out with boats. Focusing on finding the elderly. #harvey #chapelwood @… https://t.co/b72hh9Ltzy,continue get folks boat focusing finding elderly,Mon Aug 28 10:40:33 CDT 2017,"29.7811,-95.5459",thejohnstephens,Houston,"Houston, TX","(29.522325,-95.823268),(30.154665,-95.823268),(30.154665,-95.069705),(29.522325,-95.069705),",58,Willowbrook,boat,1
902194320425537538,@Dbando_msmg THEY DON'T UNDERSTAND 🤦🏽‍♂️🙏🏽😰 @ University of Houston https://t.co/wFpstjvZ3d,dbandomsmg dont understand houston,Mon Aug 28 10:41:02 CDT 2017,"29.7188233,-95.3393318",TyBeezy11,Houston,"Houston, TX","(29.522325,-95.823268),(30.154665,-95.823268),(30.154665,-95.069705),(29.522325,-95.069705),",1,Fourth Ward,,0
902194381352046592,Our hearts and soles go out to our all those effected by Hurricane Harvey. POWA and strength to… https://t.co/EnR1bbQPhH,hearts sol effect hurricane harvey powa strength,Mon Aug 28 10:41:17 CDT 2017,"29.7629,-95.3832",spherefithtx,Houston,"Houston, TX","(29.522325,-95.823268),(30.154665,-95.823268),(30.154665,-95.069705),(29.522325,-95.069705),",22,Mid West,,0
