902238586329866242,High water affecting all main lanes in #WestSide on W Sam Houston Tollway SB at The I-10 Katy Fwy #traffic https://t.co/vuUN2yElDh,high water affect main lane sam houston tollway katy fwy,Mon Aug 28 13:36:56 CDT 2017,"29.77744,-95.56273",TotalTrafficHOU,Houston,"Houston, TX","(29.522325,-95.823268),(30.154665,-95.823268),(30.154665,-95.069705),(29.522325,-95.069705),",66,Brays Oaks,water,1
902238619628429312,"Stay strong❤ #houstontexs #houstonheights #alieftx @ Houston & Katy, TX https://t.co/Qft7Plk1gP",stay strong katy,Mon Aug 28 13:37:04 CDT 2017,"29.7782307,-95.7417603",monstawarrior,Houston,"Houston, TX","(29.522325,-95.823268),(30.154665,-95.823268),(30.154665,-95.069705),(29.522325,-95.069705),",30,Downtown,,0
902238717808709633,"Want to work in #Houston, TX? View our latest opening: https://t.co/eJq9k8Xrmf #Banking #Job #Jobs #Hiring #CareerArc",want work view latest opening,Mon Aug 28 13:37:27 CDT 2017,"29.75888,-95.3638571",tmj_hou_banking,Houston,"Houston, TX","(29.522325,-95.823268),(30.154665,-95.823268),(30.154665,-95.069705),(29.522325,-95.069705),",1,Fourth Ward,,0
902238852907016192,"Interested in a #job in #Houston, TX? This could be a great fit: https://t.co/KuYiOPXIFD #IT #Hiring #CareerArc",interest could great fit,Mon Aug 28 13:37:59 CDT 2017,"29.7565807,-95.3651701",tmj_HOU_adm,Houston,"Houston, TX","(29.522325,-95.823268),(30.154665,-95.823268),(30.154665,-95.069705),(29.522325,-95.069705),",59,Fairbanks / Northwest Crossing,,0
902238932921868288,"Want to work in #Houston, TX? View our latest opening: https://t.co/tlXfVJhTUq #Legal #Job #Jobs #Hiring #CareerArc",want work view latest opening,Mon Aug 28 13:38:19 CDT 2017,"29.7484861,-95.4699173",tmj_hou_legal,Houston,"Houston, TX","(29.522325,-95.823268),(30.154665,-95.823268),(30.154665,-95.069705),(29.522325,-95.069705),",1,Fourth Ward,,0
902238986235674626,"1:100,000,000 💖😍💖💖😍 @ Houston, Texas https://t.co/HQLo1kfMmb",texas,Mon Aug 28 13:38:31 CDT 2017,"29.7629,-95.3832",DMonroe86,Houston,"Houston, TX","(29.522325,-95.823268),(30.154665,-95.823268),(30.154665,-95.069705),(29.522325,-95.069705),",52,Medical Center Area,,0
902239109627895808,This #job might be a great fit for you: Psychiatrist - Community Resource and Referral Center - https://t.co/Lkv7y9kjme #Physician #Hiring,might great fit psychiatrist community resource referral center,Mon Aug 28 13:39:01 CDT 2017,"29.7604267,-95.3698028",JobsatVA,Houston,"Houston, TX","(29.522325,-95.823268),(30.154665,-95.823268),(30.154665,-95.069705),(29.522325,-95.069705),",1,Fourth Ward,community,1
902239148341420032,My heart is breaking for my hometown and all my friends & family who have lost everything in… https://t.co/rPrHDoHd53,heart breaking hometown friend family lost everything,Mon Aug 28 13:39:10 CDT 2017,"29.7629,-95.3832",angelica__louis,Houston,"Houston, TX","(29.522325,-95.823268),(30.154665,-95.823268),(30.154665,-95.069705),(29.522325,-95.069705),",1,Fourth Ward,family,1
902239176833323008,We are Texans. @ Trinity Gardens https://t.co/kOpPtinuEn,texan garden,Mon Aug 28 13:39:17 CDT 2017,"29.8310998,-95.31827549",Gamer74360,Houston,"Houston, TX","(29.522325,-95.823268),(30.154665,-95.823268),(30.154665,-95.069705),(29.522325,-95.069705),",1,Fourth Ward,,0
902239316461494275,"Want to work in #Houston, TX? View our latest opening: https://t.co/1tM4s9snJ0 #FacilitiesMgmt #Job #Jobs #Hiring #CareerArc",want work view latest opening,Mon Aug 28 13:39:50 CDT 2017,"29.8025458,-95.4542613",tmj_TX_facmgmt,Houston,"Houston, TX","(29.522325,-95.823268),(30.154665,-95.823268),(30.154665,-95.069705),(29.522325,-95.069705),",30,Downtown,,0
902239420392366080,Anybody in the downtown area that can get to the #georgerbrownconventioncenter safely ! Go help… https://t.co/658hH0R1I9,anybody downtown area get safely help,Mon Aug 28 13:40:15 CDT 2017,"29.7629,-95.3832",DessiiWorld,Houston,"Houston, TX","(29.522325,-95.823268),(30.154665,-95.823268),(30.154665,-95.069705),(29.522325,-95.069705),",30,Downtown,help,1
902239780116676609,"If you're stranded in Katy , Contact #2816878992 ‼️‼️ #hurricaneharvey #houston @ Houston, Texas https://t.co/uRX4jT6BDX",youre strand katy contact texas,Mon Aug 28 13:41:41 CDT 2017,"29.7629,-95.3832",DessiiWorld,Houston,"Houston, TX","(29.522325,-95.823268),(30.154665,-95.823268),(30.154665,-95.069705),(29.522325,-95.069705),",53,East Houston,contact,1
902239971544768513,"We're #hiring! Read about our latest #job opening here: Registered Nurse - Medical Oncology - https://t.co/rs8c2kXcB8 #Nursing #Houston, TX",read latest opening register nurse medical oncology,Mon Aug 28 13:42:26 CDT 2017,"29.7138126,-95.3963819",tmj_hou_nursing,Houston,"Houston, TX","(29.522325,-95.823268),(30.154665,-95.823268),(30.154665,-95.069705),(29.522325,-95.069705),",30,Downtown,nurse,1
902240092487593984,"#HurricaneHarvey #Houston #PrayForHouston #Pray4Houston #HelpSomeoneHelpSomeone @ Houston, Texas https://t.co/wIdsLlyXzw",texas,Mon Aug 28 13:42:55 CDT 2017,"29.7629,-95.3832",devonturner21,Houston,"Houston, TX","(29.522325,-95.823268),(30.154665,-95.823268),(30.154665,-95.069705),(29.522325,-95.069705),",2,Greater Uptown,,0
902240126771892224,#Repost @kylehubbardhtx  ・・・ Bottom area code is also 281 #Repost… https://t.co/NslDHbUlbt,kylehubbardhtx bottom area code also,Mon Aug 28 13:43:03 CDT 2017,"29.7629,-95.3832",jodyseabody,Houston,"Houston, TX","(29.522325,-95.823268),(30.154665,-95.823268),(30.154665,-95.069705),(29.522325,-95.069705),",66,Brays Oaks,,0
902240154185846784,Exit blocked due to flooding in #SeSide on 610 N Lp EB at The 45 Gulf Fwy #traffic https://t.co/vuUN2yElDh,exit block due flooding gulf fwy,Mon Aug 28 13:43:10 CDT 2017,"29.6973,-95.28931",TotalTrafficHOU,Houston,"Houston, TX","(29.522325,-95.823268),(30.154665,-95.823268),(30.154665,-95.069705),(29.522325,-95.069705),",6,Washington Avenue Coalition / Memorial Park,,0
902240158589886464,High water affecting all main lanes in #SouthSide on Hwy 288 SB at Holly Hall #traffic https://t.co/vuUN2yElDh,high water affect main lane hwy holly hall,Mon Aug 28 13:43:11 CDT 2017,"29.68686,-95.37877",TotalTrafficHOU,Houston,"Houston, TX","(29.522325,-95.823268),(30.154665,-95.823268),(30.154665,-95.069705),(29.522325,-95.069705),",30,Downtown,water,1
902240165355237379,High water affecting all main lanes in #Katy on Hwy 99 Grand Pkwy NB at Clay Rd #traffic https://t.co/vuUN2yElDh,high water affect main lane hwy grand pkwy clay,Mon Aug 28 13:43:12 CDT 2017,"29.83167,-95.76052",TotalTrafficHOU,Houston,"Houston, TX","(29.522325,-95.823268),(30.154665,-95.823268),(30.154665,-95.069705),(29.522325,-95.069705),",57,East Little York / Homestead,water,1
902240177455853569,After this I'll never be judgmental about a natural disaster ever again,ill never judgmental natural disaster ever,Mon Aug 28 13:43:15 CDT 2017,"29.746343,-95.365081",WinkWestwood,Houston,"Houston, TX","(29.522325,-95.823268),(30.154665,-95.823268),(30.154665,-95.069705),(29.522325,-95.069705),",30,Downtown,,0
902240203875557376,"Interested in a #job in #Houston, TX? This could be a great fit: https://t.co/ea3PDiGalY #Accounting #Hiring #CareerArc",interest could great fit,Mon Aug 28 13:43:22 CDT 2017,"29.799804,-95.37446",tmj_hou_acct,Houston,"Houston, TX","(29.522325,-95.823268),(30.154665,-95.823268),(30.154665,-95.069705),(29.522325,-95.069705),",1,Fourth Ward,,0
902240285551353856,"Can you recommend anyone for this #job in #Houston, TX? https://t.co/xczCHZfsqo #BusinessMgmt #Hiring #CareerArc",recommend anyone,Mon Aug 28 13:43:41 CDT 2017,"29.7604267,-95.3698028",HouJobs,Houston,"Houston, TX","(29.522325,-95.823268),(30.154665,-95.823268),(30.154665,-95.069705),(29.522325,-95.069705),",5,Eldridge / West Oaks,,0
902240367642337282,"#USGS08075500 - Sims Bayou at Houston, TX  Heavy Rain (0.4 in/hr) over the last 15 minutes  https://t.co/e1I1GPVgr9",sims bayou houston heavy rain inhr last minutes,Mon Aug 28 13:44:01 CDT 2017,"29.67439687,-95.2893807",USGS_TexasRain,Houston,"Houston, TX","(29.522325,-95.823268),(30.154665,-95.823268),(30.154665,-95.069705),(29.522325,-95.069705),",52,Medical Center Area,,0
902240451801034752,"#bottleup @ Southbelt - Ellington, Houston https://t.co/qFHLVl4pcz",ellington houston,Mon Aug 28 13:44:21 CDT 2017,"29.60987982,-95.21299523",jerma1,Houston,"Houston, TX","(29.522325,-95.823268),(30.154665,-95.823268),(30.154665,-95.069705),(29.522325,-95.069705),",1,Fourth Ward,,0
902240452379779072,"Can you recommend anyone for this #job? SAP Ariba Consultant - https://t.co/xPsh9yK7gD #ProjectMgmt #Houston, TX #Hiring #CareerArc",recommend anyone sap ariba consultant,Mon Aug 28 13:44:21 CDT 2017,"29.7535357,-95.3657714",tmj_hou_itpm,Houston,"Houston, TX","(29.522325,-95.823268),(30.154665,-95.823268),(30.154665,-95.069705),(29.522325,-95.069705),",30,Downtown,,0
902240526577135616,We're #hiring! Read about our latest #job opening here: Regional Administrator - West Houston - https://t.co/goYpZK2w0X #Admin #Mgmt,read latest opening regional administrator west houston,Mon Aug 28 13:44:39 CDT 2017,"29.7604267,-95.3698028",tmj_hou_health,Houston,"Houston, TX","(29.522325,-95.823268),(30.154665,-95.823268),(30.154665,-95.069705),(29.522325,-95.069705),",30,Downtown,,0
902240614913323008,"#USGS08068780 - Little Cypress Ck nr Cypress, TX Height: 160.34ft ▲ (156.5ft) Flow: 5700cfs https://t.co/VO6cVohxvx",little cypress cypress height flow,Mon Aug 28 13:45:00 CDT 2017,"30.01605437,-95.6974463",USGS_TexasFlood,Houston,"Houston, TX","(29.522325,-95.823268),(30.154665,-95.823268),(30.154665,-95.069705),(29.522325,-95.069705),",70,Westchase,,0
902240617446727680,High water affecting all main lanes in #Spring on Hwy 99 Grand Pkwy WB after Spg Stuebner Rd #traffic https://t.co/vuUN2yElDh,high water affect main lane hwy grand pkwy spg stuebner,Mon Aug 28 13:45:00 CDT 2017,"30.08649,-95.52993",TotalTrafficHOU,Houston,"Houston, TX","(29.522325,-95.823268),(30.154665,-95.823268),(30.154665,-95.069705),(29.522325,-95.069705),",1,Fourth Ward,water,1
902240740847214592,We're #hiring! Read about our latest #job opening here: Sales Training and Development Consultant - https://t.co/BjMocxs5jt #Sales,read latest opening sales training development consultant,Mon Aug 28 13:45:30 CDT 2017,"29.7508512,-95.4122817",tmj_hou_sales,Houston,"Houston, TX","(29.522325,-95.823268),(30.154665,-95.823268),(30.154665,-95.069705),(29.522325,-95.069705),",1,Fourth Ward,,0
902240763454656513,High water affecting all lanes in #Houston on I-69 Eastex Fwy Frontage Rd Inbound between Little York Rd and Parker Rd #traffic,high water affect lane eastex fwy frontage inbound little york parker,Mon Aug 28 13:45:35 CDT 2017,"29.87043,-95.33056",TotalTrafficHOU,Houston,"Houston, TX","(29.522325,-95.823268),(30.154665,-95.823268),(30.154665,-95.069705),(29.522325,-95.069705),",21,Greenway / Upper Kirby Area,water,1
902240816487440384,George R Brown is open and looking for volunteers to help if you can get there #Houston,george brown open looking volunteer help get,Mon Aug 28 13:45:48 CDT 2017,"29.745027,-95.364586",WinkWestwood,Houston,"Houston, TX","(29.522325,-95.823268),(30.154665,-95.823268),(30.154665,-95.069705),(29.522325,-95.069705),",2,Greater Uptown,help volunteer,2
902240900847472640,High water affecting all lanes in #Houston on I-69 Eastex Fwy Frontage Rd Inbound between The 610 N Lp and Collingsworth St #traffic,high water affect lane eastex fwy frontage inbound collingsworth,Mon Aug 28 13:46:08 CDT 2017,"29.81015,-95.33439",TotalTrafficHOU,Houston,"Houston, TX","(29.522325,-95.823268),(30.154665,-95.823268),(30.154665,-95.069705),(29.522325,-95.069705),",5,Eldridge / West Oaks,water,1
902241023052570624,"Sharing, because I want to show how our shares are working to get people rescued. Thank you! 🙏🏾… https://t.co/4qdjOI75Nk",sharing want show share working get people rescue thank,Mon Aug 28 13:46:37 CDT 2017,"29.7629,-95.3832",DiceyGrenor,Houston,"Houston, TX","(29.522325,-95.823268),(30.154665,-95.823268),(30.154665,-95.069705),(29.522325,-95.069705),",52,Medical Center Area,people rescue,2
902241066472022016,High water affecting all lanes in #Harris on W Sam Houston Tollway SB Frontage Rd at Westheimer Rd #traffic https://t.co/vuUN2ymKeH,high water affect lane sam houston tollway frontage westheimer,Mon Aug 28 13:46:47 CDT 2017,"29.73704,-95.55709",TotalTrafficHOU,Houston,"Houston, TX","(29.522325,-95.823268),(30.154665,-95.823268),(30.154665,-95.069705),(29.522325,-95.069705),",30,Downtown,water,1
902241069986930689,High water affecting all lanes in #Pasadena on Hwy 225 La Porte Fwy Frontage rd EB between Allen Genoa and Bearle #traffic,high water affect lane hwy porte fwy frontage allen genoa bearle,Mon Aug 28 13:46:48 CDT 2017,"29.70585,-95.24492",TotalTrafficHOU,Houston,"Houston, TX","(29.522325,-95.823268),(30.154665,-95.823268),(30.154665,-95.069705),(29.522325,-95.069705),",30,Downtown,water,1
902241121421721600,"I'm on the Southeast (Blueridge) . Our area is good . Anyone else ? @ Southeast Houston,… https://t.co/CmdOZ5qTJS",southeast blueridge area good anyone else houston,Mon Aug 28 13:47:00 CDT 2017,"29.65941153,-95.31175519",Shquindat,Houston,"Houston, TX","(29.522325,-95.823268),(30.154665,-95.823268),(30.154665,-95.069705),(29.522325,-95.069705),",1,Fourth Ward,,0
902241163687616512,"Wait, are you saying we've got MORE rain coming? 👀 #hurricaneharvey #rainraingoaway☔️… https://t.co/egMkTHssBc",wait saying weve get rain coming,Mon Aug 28 13:47:10 CDT 2017,"29.7978,-95.3978",GwenandPecos,Houston,"Houston, TX","(29.522325,-95.823268),(30.154665,-95.823268),(30.154665,-95.069705),(29.522325,-95.069705),",5,Eldridge / West Oaks,,0
902241223313956864,High water affecting all lanes in #WestSide on Hwy 6 SB at Patterson #traffic https://t.co/vuUN2yElDh,high water affect lane hwy patterson,Mon Aug 28 13:47:25 CDT 2017,"29.81329,-95.64545",TotalTrafficHOU,Houston,"Houston, TX","(29.522325,-95.823268),(30.154665,-95.823268),(30.154665,-95.069705),(29.522325,-95.069705),",25,Memorial,water,1
902241273980915714,Thanks majic1021 ! #thepeoplesstation  #DigItHTown @ In My Zone https://t.co/i1MNBJAZtU,thanks majic zone,Mon Aug 28 13:47:37 CDT 2017,"29.64188885,-95.5311781",MoFromPromo,Houston,"Houston, TX","(29.522325,-95.823268),(30.154665,-95.823268),(30.154665,-95.069705),(29.522325,-95.069705),",84,Meyerland Area,,0
902241369044918274,"Can you recommend anyone for this #job in #Houston, TX? https://t.co/gW3a82W5Bi #Nursing #Hiring #CareerArc",recommend anyone,Mon Aug 28 13:47:59 CDT 2017,"29.7138126,-95.3963819",tmj_hou_nursing,Houston,"Houston, TX","(29.522325,-95.823268),(30.154665,-95.823268),(30.154665,-95.069705),(29.522325,-95.069705),",1,Fourth Ward,,0
902241419074473984,"He's reunited with his mom ‼️ #hurricaneharvey @ Houston, Texas https://t.co/KmPEmYq0af",reunite mom texas,Mon Aug 28 13:48:11 CDT 2017,"29.7629,-95.3832",DessiiWorld,Houston,"Houston, TX","(29.522325,-95.823268),(30.154665,-95.823268),(30.154665,-95.069705),(29.522325,-95.069705),",1,Fourth Ward,,0
902241632535248896,"Much love to everyone for your thoughts, concerns and prayers. So fortunate to be safe.… https://t.co/XaSRQrs7gF",much love everyone thought concern prayer fortunate safe,Mon Aug 28 13:49:02 CDT 2017,"29.7629,-95.3832",ricardorene73,Houston,"Houston, TX","(29.522325,-95.823268),(30.154665,-95.823268),(30.154665,-95.069705),(29.522325,-95.069705),",19,Meadowbrook / Allendale,safe,1
902241789528047616,Just posted a photo @ Mesa Rd https://t.co/65LIN37lx0,post photo,Mon Aug 28 13:49:40 CDT 2017,"29.84863523,-95.25959631",checktjout,Houston,"Houston, TX","(29.522325,-95.823268),(30.154665,-95.823268),(30.154665,-95.069705),(29.522325,-95.069705),",1,Fourth Ward,,0
902241838597234688,"See our latest #Houston, TX #job and click to apply: PwC IT Portfolio/Sourcing Senior Manager - https://t.co/ZZF9Yoq6zl #IT #Hiring",see latest click apply pwc portfoliosourcing senior manager,Mon Aug 28 13:49:51 CDT 2017,"29.7584166,-95.3683008",tmj_HOU_adm,Houston,"Houston, TX","(29.522325,-95.823268),(30.154665,-95.823268),(30.154665,-95.069705),(29.522325,-95.069705),",1,Fourth Ward,,0
902241847648460801,"HELP ‼️ #hurricaneharvey #houston @ Houston, Texas https://t.co/CgticppkFD",help texas,Mon Aug 28 13:49:53 CDT 2017,"29.7629,-95.3832",DessiiWorld,Houston,"Houston, TX","(29.522325,-95.823268),(30.154665,-95.823268),(30.154665,-95.069705),(29.522325,-95.069705),",71,Alief,help,1
902241878770237440,"Want to work in #Houston, TX? View our latest opening: https://t.co/mAcEubPZPL #Transportation #Job #Jobs #Hiring #CareerArc",want work view latest opening,Mon Aug 28 13:50:01 CDT 2017,"29.7604267,-95.3698028",tmj_hou_transp,Houston,"Houston, TX","(29.522325,-95.823268),(30.154665,-95.823268),(30.154665,-95.069705),(29.522325,-95.069705),",30,Downtown,,0
902241992716857344,You won't believe this guy.  #vines #Houston #Texas #hurricane #harvey #lamontgilbert @ Bright… https://t.co/gjVFVW5FfF,wont believe guy,Mon Aug 28 13:50:28 CDT 2017,"29.735508,-95.6321549",lamontg39,Houston,"Houston, TX","(29.522325,-95.823268),(30.154665,-95.823268),(30.154665,-95.069705),(29.522325,-95.069705),",36,Lazy Brook / Timbergrove,,0
902242053198716928,"If you're looking for work in #Cypress, TX, check out this #job: https://t.co/zroO4cRXu5 #Labor #Hiring",youre looking work check,Mon Aug 28 13:50:42 CDT 2017,"29.9716905,-95.6937856",tmj_hou_labor,Houston,"Houston, TX","(29.522325,-95.823268),(30.154665,-95.823268),(30.154665,-95.069705),(29.522325,-95.069705),",1,Fourth Ward,,0
902242174691033089,"Can you recommend anyone for this #job in #Houston, TX? https://t.co/TS0EEDePLV #BusinessMgmt #Hiring #CareerArc",recommend anyone,Mon Aug 28 13:51:11 CDT 2017,"29.7599563,-95.3669833",tmj_hou_mgmt,Houston,"Houston, TX","(29.522325,-95.823268),(30.154665,-95.823268),(30.154665,-95.069705),(29.522325,-95.069705),",1,Fourth Ward,,0
902242332468285441,#Repost @SundayFundayFam (get_repost) ・・・ We are speechless. This is for you Houston. We are… https://t.co/rxM4FJqqSl,sundayfundayfam getrepost speechless houston,Mon Aug 28 13:51:49 CDT 2017,"29.7629,-95.3832",Monster_Rigging,Houston,"Houston, TX","(29.522325,-95.823268),(30.154665,-95.823268),(30.154665,-95.069705),(29.522325,-95.069705),",87,Briarforest Area,,0
902242465159159808,"This #job might be a great fit for you: Security Architect - https://t.co/ixtEKqPh3h #IT #Houston, TX #Hiring #CareerArc",might great fit security architect,Mon Aug 28 13:52:21 CDT 2017,"29.7604267,-95.3698028",tmj_hou_it,Houston,"Houston, TX","(29.522325,-95.823268),(30.154665,-95.823268),(30.154665,-95.069705),(29.522325,-95.069705),",61,Westwood,,0
902242584365551617,"See our latest #Houston, TX #job and click to apply: Project Manager - https://t.co/1oYqFKYLKx #Clerical #Hiring",see latest click apply project manager,Mon Aug 28 13:52:49 CDT 2017,"29.77,-95.37",LovesJobs,Houston,"Houston, TX","(29.522325,-95.823268),(30.154665,-95.823268),(30.154665,-95.069705),(29.522325,-95.069705),",30,Downtown,,0
902242661616070656,#htown #devistation my heart and prays go out to my home and it's… https://t.co/b1FS7FPrj0,heart pray home,Mon Aug 28 13:53:08 CDT 2017,"29.7629,-95.3832",C_monkey_x,Houston,"Houston, TX","(29.522325,-95.823268),(30.154665,-95.823268),(30.154665,-95.069705),(29.522325,-95.069705),",19,Meadowbrook / Allendale,home,1
902242793694695424,"We're #hiring! Click to apply: Registered Nurse - https://t.co/moA3TvXiAN #Nursing #Houston, TX #Job #Jobs #CareerArc",click apply register nurse,Mon Aug 28 13:53:39 CDT 2017,"29.7373078,-95.5740797",tmj_hou_nursing,Houston,"Houston, TX","(29.522325,-95.823268),(30.154665,-95.823268),(30.154665,-95.069705),(29.522325,-95.069705),",30,Downtown,nurse,1
902243030635249664,Yea but that guy SWEARS KHOU SAID MANDITORY EVACUATION IN PASADENA/SOHO... PROBABLY WATCHING… https://t.co/pERHX6U52Y,yea guy swear khou say manditory evacuation pasadenasoho probably watching,Mon Aug 28 13:54:36 CDT 2017,"29.6795207,-95.2314663",Dannyboy1112,Houston,"Houston, TX","(29.522325,-95.823268),(30.154665,-95.823268),(30.154665,-95.069705),(29.522325,-95.069705),",1,Fourth Ward,,0
902243065221480448,"If you're stranded ‼️#cypresstx #hurricaneharvey @ Houston, Texas https://t.co/BR7aSlYqB1",youre strand texas,Mon Aug 28 13:54:44 CDT 2017,"29.7629,-95.3832",DessiiWorld,Houston,"Houston, TX","(29.522325,-95.823268),(30.154665,-95.823268),(30.154665,-95.069705),(29.522325,-95.069705),",88,Neartown - Montrose,,0
902243278581448704,"""Lock In"" 2017 Hurricane Harvey Moma and my ""Mini Me"". Resting til my shift start.⛈⛆ @ Kindred… https://t.co/g0QdvfiCyX",lock hurricane harvey moma mini rest til shift start,Mon Aug 28 13:55:35 CDT 2017,"29.80957,-95.432",blackqueen2327,Houston,"Houston, TX","(29.522325,-95.823268),(30.154665,-95.823268),(30.154665,-95.069705),(29.522325,-95.069705),",2,Greater Uptown,,0
902243316284129282,A lot of stores have lines right outside right now and some are only taking debit or credit only. No cash,lot store line right outside right taking debit credit cash,Mon Aug 28 13:55:44 CDT 2017,"29.750996,-95.374142",WinkWestwood,Houston,"Houston, TX","(29.522325,-95.823268),(30.154665,-95.823268),(30.154665,-95.069705),(29.522325,-95.069705),",1,Fourth Ward,store,1
902243365646979073,It's a Steel Magnolia movie kind of day with #vivithebeautiful and krivoruchko_irina… https://t.co/f1dkf9MqgS,steel magnolia movie kind day krivoruchkoirina,Mon Aug 28 13:55:55 CDT 2017,"29.7629,-95.3832",CheAlexander,Houston,"Houston, TX","(29.522325,-95.823268),(30.154665,-95.823268),(30.154665,-95.069705),(29.522325,-95.069705),",30,Downtown,,0
902243426715951104,"We're #hiring! Click to apply: Private Client Banker - West Central Market - Houston, TX - https://t.co/fscpqmUOuH #Banking #Houston, TX",click apply private client banker west central market houston,Mon Aug 28 13:56:10 CDT 2017,"29.75888,-95.3638571",tmj_hou_banking,Houston,"Houston, TX","(29.522325,-95.823268),(30.154665,-95.823268),(30.154665,-95.069705),(29.522325,-95.069705),",1,Fourth Ward,,0
902243592835522561,"Can you recommend anyone for this #job in #Houston, TX? https://t.co/6p96FXQYkn #CustomerService #Veterans #Hiring",recommend anyone,Mon Aug 28 13:56:50 CDT 2017,"29.7604267,-95.3698028",tmj_hou_cstsrv,Houston,"Houston, TX","(29.522325,-95.823268),(30.154665,-95.823268),(30.154665,-95.069705),(29.522325,-95.069705),",1,Fourth Ward,,0
902243814496194561,Thanks majic1021 .  #thepeoplesstation  #DigItHTown @ In My Zone https://t.co/qi45CHELGn,thanks majic zone,Mon Aug 28 13:57:42 CDT 2017,"29.64188885,-95.5311781",MoFromPromo,Houston,"Houston, TX","(29.522325,-95.823268),(30.154665,-95.823268),(30.154665,-95.069705),(29.522325,-95.069705),",25,Memorial,,0
902243890723299328,"Want to work in #Houston, TX? View our latest opening: https://t.co/dSGqQ56aB0 #BusinessMgmt #Job #Jobs #Hiring",want work view latest opening,Mon Aug 28 13:58:01 CDT 2017,"29.7604267,-95.3698028",tmj_hou_mgmt,Houston,"Houston, TX","(29.522325,-95.823268),(30.154665,-95.823268),(30.154665,-95.069705),(29.522325,-95.069705),",84,Meyerland Area,,0
902243982088003584,"Just posted a photo @ Houston, Texas https://t.co/LkBwVKoaMs",post photo texas,Mon Aug 28 13:58:22 CDT 2017,"29.7629,-95.3832",JLeal713,Houston,"Houston, TX","(29.522325,-95.823268),(30.154665,-95.823268),(30.154665,-95.069705),(29.522325,-95.069705),",30,Downtown,,0
902244275802464256,Nurses this is a part of it. Hurricane Harvey 2017 Lock In @ Kindred Hospital The Heights https://t.co/EVf54N4xvD,nurse part hurricane harvey lock hospital heights,Mon Aug 28 13:59:32 CDT 2017,"29.80957,-95.432",blackqueen2327,Houston,"Houston, TX","(29.522325,-95.823268),(30.154665,-95.823268),(30.154665,-95.069705),(29.522325,-95.069705),",30,Downtown,nurse,1
902244518405087232,I can't even wrap my mind around the devastation that's occurring in my city right now. Houston… https://t.co/9i5lLZJmS3,cant even wrap mind around devastation thats occur city right houston,Mon Aug 28 14:00:30 CDT 2017,"29.7629,-95.3832",ItsIMANIrose,Houston,"Houston, TX","(29.522325,-95.823268),(30.154665,-95.823268),(30.154665,-95.069705),(29.522325,-95.069705),",1,Fourth Ward,,0
902244601918095364,"#HurricaneHarvey #Houston #Pray4Houston #PrayForHouston #HelpSomeoneHelpSomeone @ Houston, Texas https://t.co/Ng8UMdMb2s",texas,Mon Aug 28 14:00:50 CDT 2017,"29.7629,-95.3832",devonturner21,Houston,"Houston, TX","(29.522325,-95.823268),(30.154665,-95.823268),(30.154665,-95.069705),(29.522325,-95.069705),",19,Meadowbrook / Allendale,,0
902244645719072768,"This #job might be a great fit for you: Assistant Director, Multicultural Affairs - https://t.co/AL5CJR434i #Education #Houston, TX",might great fit assistant director multicultural affairs,Mon Aug 28 14:01:01 CDT 2017,"29.7184075,-95.3980766",tmj_hou_edu,Houston,"Houston, TX","(29.522325,-95.823268),(30.154665,-95.823268),(30.154665,-95.069705),(29.522325,-95.069705),",75,Astrodome Area,,0
902244781790683137,We're #hiring! Read about our latest #job opening here: Research Coordinator I - Neurosurgery - https://t.co/3g7qSNmrcA #Healthcare,read latest opening research coordinator neurosurgery,Mon Aug 28 14:01:33 CDT 2017,"29.7604267,-95.3698028",tmj_hou_health,Houston,"Houston, TX","(29.522325,-95.823268),(30.154665,-95.823268),(30.154665,-95.069705),(29.522325,-95.069705),",1,Fourth Ward,,0
902244804330971139,The stores are only letting a few people in at a time to shop for necessities for good reason,store letting people time shop necessity good reason,Mon Aug 28 14:01:38 CDT 2017,"29.735084,-95.381914",WinkWestwood,Houston,"Houston, TX","(29.522325,-95.823268),(30.154665,-95.823268),(30.154665,-95.069705),(29.522325,-95.069705),",19,Meadowbrook / Allendale,people store,2
