901819933092323328,"Can you recommend anyone for this #job in #Houston, TX? https://t.co/S0JUqGg36z #Hiring #CareerArc",recommend anyone,Sun Aug 27 09:53:21 CDT 2017,"29.7484861,-95.4699173",tmj_hou_jobs,Houston,"Houston, TX","(29.522325,-95.823268),(30.154665,-95.823268),(30.154665,-95.069705),(29.522325,-95.069705),",30,Downtown,,0
901820143411630080,"Les pedimos por favor sus oraciones por #Houston y sus alrededores y el estado de #Texas,… https://t.co/Vmt92EWEZs",pedimos por favor sus oraciones por sus alrededores estado,Sun Aug 27 09:54:11 CDT 2017,"29.7629,-95.3832",delcidjosue,Houston,"Houston, TX","(29.522325,-95.823268),(30.154665,-95.823268),(30.154665,-95.069705),(29.522325,-95.069705),",35,Denver Harbor / Port Houston,,0
901820169835737089,Please Pray for Houston! Call and check on your love one! This is real life and death! @… https://t.co/08QdxCIZLc,please pray houston call check love one real life death,Sun Aug 27 09:54:18 CDT 2017,"29.86702833,-95.7238483",LUVNJUSTUS4,Houston,"Houston, TX","(29.522325,-95.823268),(30.154665,-95.823268),(30.154665,-95.069705),(29.522325,-95.069705),",30,Downtown,call,1
901820331576438785,"#prayforhouston #hurricaneharvey @ Westside, Houston, Texas https://t.co/JVi3ydtKyW",houston texas,Sun Aug 27 09:54:56 CDT 2017,"29.72418314,-95.61990397",ig_iamkj,Houston,"Houston, TX","(29.522325,-95.823268),(30.154665,-95.823268),(30.154665,-95.069705),(29.522325,-95.069705),",30,Downtown,,0
901820515903344640,"Can you recommend anyone for this #job? Trainer, Solar Panel Installation (Part Time) - https://t.co/BV9miGnqtn #Education #Houston, TX",recommend anyone trainer solar panel installation part time,Sun Aug 27 09:55:40 CDT 2017,"29.7422641,-95.3771355",tmj_hou_edu,Houston,"Houston, TX","(29.522325,-95.823268),(30.154665,-95.823268),(30.154665,-95.069705),(29.522325,-95.069705),",30,Downtown,,0
901820602603806720,I-59 and 288 split between Midtown and Third Ward. #HurricaneHarvey… https://t.co/7BOb1MQw1F,split midtown third ward,Sun Aug 27 09:56:01 CDT 2017,"29.73,-95.36",JXM85,Houston,"Houston, TX","(29.522325,-95.823268),(30.154665,-95.823268),(30.154665,-95.069705),(29.522325,-95.069705),",52,Medical Center Area,,0
901820670883049473,4 helpful hints for those dealing with    #floods #emergencies #emergencynumbers #houston… https://t.co/kZon1BZC65,helpful hint dealing,Sun Aug 27 09:56:17 CDT 2017,"29.7629,-95.3832",GoonageIsReal,Houston,"Houston, TX","(29.522325,-95.823268),(30.154665,-95.823268),(30.154665,-95.069705),(29.522325,-95.069705),",30,Downtown,,0
901820937460264960,"Can you recommend anyone for this #job in #Houston, TX? https://t.co/Z8sUEJhUQH #Green #Veterans #Hiring #CareerArc",recommend anyone,Sun Aug 27 09:57:21 CDT 2017,"29.7604267,-95.3698028",SABICCareers,Houston,"Houston, TX","(29.522325,-95.823268),(30.154665,-95.823268),(30.154665,-95.069705),(29.522325,-95.069705),",36,Lazy Brook / Timbergrove,,0
901820948512256000,"Can you recommend anyone for this #job in #Houston, TX? https://t.co/TjxBeKEWjh #Nursing #Hiring #CareerArc",recommend anyone,Sun Aug 27 09:57:23 CDT 2017,"29.7604267,-95.3698028",tmj_hou_nursing,Houston,"Houston, TX","(29.522325,-95.823268),(30.154665,-95.823268),(30.154665,-95.069705),(29.522325,-95.069705),",67,Central Southwest,,0
901821272795045888,Asking for all to continue to pray for us in the Houston area and those still being impacted by… https://t.co/ENjBb04emX,asking continue pray houston area still impact,Sun Aug 27 09:58:41 CDT 2017,"29.7629,-95.3832",CalderonCesarA,Houston,"Houston, TX","(29.522325,-95.823268),(30.154665,-95.823268),(30.154665,-95.069705),(29.522325,-95.069705),",37,Greater Heights,,0
901821316935827457,"Can you recommend anyone for this #job? Levi's Outlet - Sales Stylist (Cypress) - https://t.co/hr8aBuy6hk #Retail #Cypress, TX #Hiring",recommend anyone levis outlet sales stylist cypress,Sun Aug 27 09:58:51 CDT 2017,"29.9968226,-95.7573856",tmj_hou_retail,Houston,"Houston, TX","(29.522325,-95.823268),(30.154665,-95.823268),(30.154665,-95.069705),(29.522325,-95.069705),",37,Greater Heights,,0
901821588223528960,#Lol man #Chicken was dead serious bout this #Houston #Weather ol #Harvey got the #Flood game on… https://t.co/SfsKjaSR0U,man dead serious bout get game,Sun Aug 27 09:59:56 CDT 2017,"29.7629,-95.3832",kingeatgreedy,Houston,"Houston, TX","(29.522325,-95.823268),(30.154665,-95.823268),(30.154665,-95.069705),(29.522325,-95.069705),",30,Downtown,,0
901821634843049984,"We're #hiring! Read about our latest #job opening here: POLICE OFFICER - https://t.co/3uAYf18Apo #security #Houston, TX #CareerArc",read latest opening police officer,Sun Aug 27 10:00:07 CDT 2017,"29.9668524,-95.3622155",HouJobs,Houston,"Houston, TX","(29.522325,-95.823268),(30.154665,-95.823268),(30.154665,-95.069705),(29.522325,-95.069705),",22,Mid West,,0
901821959905927170,"#USGS08068780 - Little Cypress Ck nr Cypress, TX Height: 160.82ft ▲ (156.5ft) Flow: 7370cfs https://t.co/ekDMeA5fOH",little cypress cypress height flow,Sun Aug 27 10:01:24 CDT 2017,"30.01605437,-95.6974463",USGS_TexasFlood,Houston,"Houston, TX","(29.522325,-95.823268),(30.154665,-95.823268),(30.154665,-95.069705),(29.522325,-95.069705),",30,Downtown,,0
901822123089547265,Lmfaoooooooooo chill 😭😭😭😭😭😭 https://t.co/RtmwzNIMzM,lmfaoooooooooo chill,Sun Aug 27 10:02:03 CDT 2017,"29.63963964,-95.50563573",_ClutchCity,Houston,"Houston, TX","(29.522325,-95.823268),(30.154665,-95.823268),(30.154665,-95.069705),(29.522325,-95.069705),",52,Medical Center Area,,0
901822216211501056,"#USGS08068325 - Willow Ck nr Tomball, TX Height: 131.09ft ▲ (127.9ft) Flow: 4090cfs https://t.co/C6JEbs8Wmo",willow tomball height flow,Sun Aug 27 10:02:26 CDT 2017,"30.10549526,-95.5466084",USGS_TexasFlood,Houston,"Houston, TX","(29.522325,-95.823268),(30.154665,-95.823268),(30.154665,-95.069705),(29.522325,-95.069705),",30,Downtown,,0
901822331324030980,"We're #hiring! Click to apply: Biomedical Technician/ Medical Equipment Tech - Houston, TX 77033 - https://t.co/7T355EoedG #dialysis #Job",click apply biomedical technician medical equipment tech houston,Sun Aug 27 10:02:53 CDT 2017,"29.7604267,-95.3698028",tmj_hou_pharm,Houston,"Houston, TX","(29.522325,-95.823268),(30.154665,-95.823268),(30.154665,-95.069705),(29.522325,-95.069705),",36,Lazy Brook / Timbergrove,,0
901822374743441409,"Interested in a #job in #Houston, TX? This could be a great fit: https://t.co/vi7znqopU0 #RN #Nurse #ER #Hiring",interest could great fit,Sun Aug 27 10:03:03 CDT 2017,"29.7604267,-95.3698028",tmj_hou_nursing,Houston,"Houston, TX","(29.522325,-95.823268),(30.154665,-95.823268),(30.154665,-95.069705),(29.522325,-95.069705),",52,Medical Center Area,,0
901822443165286400,#hurricabeharvey #hurricane #tropicalstorm #houston #boat 😂😂😂😂 look at what my family pulled out… https://t.co/Lr5WC1EHNt,look family pull,Sun Aug 27 10:03:20 CDT 2017,"29.65941153,-95.31175519",myion_,Houston,"Houston, TX","(29.522325,-95.823268),(30.154665,-95.823268),(30.154665,-95.069705),(29.522325,-95.069705),",5,Eldridge / West Oaks,family,1
901822493379502083,Currently outside my apartments. 🤦🏾‍♂️🤦🏾‍♂️ #PrayForHouston… https://t.co/bRcvvu96vF,currently outside apartment,Sun Aug 27 10:03:32 CDT 2017,"29.7629,-95.3832",DjSpikeLeon214,Houston,"Houston, TX","(29.522325,-95.823268),(30.154665,-95.823268),(30.154665,-95.069705),(29.522325,-95.069705),",1,Fourth Ward,,0
901822535779717120,"This Sumner I got to catch up with my H town friends. Today I'm praying for all of my Houston,… https://t.co/QkIkzxgAfy",sumner get catch town friend today pray houston,Sun Aug 27 10:03:42 CDT 2017,"29.73919547,-95.46343417",brandisdiary,Houston,"Houston, TX","(29.522325,-95.823268),(30.154665,-95.823268),(30.154665,-95.069705),(29.522325,-95.069705),",30,Downtown,,0
901822718882041856,"#USGS08075900 - Greens Bayou nr US Hwy 75 nr Houston, TX Height: 85.45ft ▼ (84.8ft) Flow: 11500cfs https://t.co/pve6LMew6o",greens bayou hwy houston height flow,Sun Aug 27 10:04:25 CDT 2017,"29.95688886,-95.4179936",USGS_TexasFlood,Houston,"Houston, TX","(29.522325,-95.823268),(30.154665,-95.823268),(30.154665,-95.069705),(29.522325,-95.069705),",30,Downtown,,0
901822908657541120,"Turn around, what if I drown? Trying to get to the airport. Might miss the #vmas  #vmas2017 ☹… https://t.co/JhKI0Nw6sm",turn around drown try get airport might miss,Sun Aug 27 10:05:11 CDT 2017,"29.7629,-95.3832",MisterAnthonyT,Houston,"Houston, TX","(29.522325,-95.823268),(30.154665,-95.823268),(30.154665,-95.069705),(29.522325,-95.069705),",52,Medical Center Area,,0
901823021228453888,High water on three right lanes in #GreenwayUpperKirby on US-69 NB after Shepherd #traffic https://t.co/vuUN2yElDh,high water three right lane shepherd,Sun Aug 27 10:05:37 CDT 2017,"29.73079,-95.41284",TotalTrafficHOU,Houston,"Houston, TX","(29.522325,-95.823268),(30.154665,-95.823268),(30.154665,-95.069705),(29.522325,-95.069705),",1,Fourth Ward,water,1
901823153042743297,Just posted a video @ NASA's Johnson Space Center https://t.co/UGqvoE5XIk,post video johnson space center,Sun Aug 27 10:06:09 CDT 2017,"29.55185236,-95.09775266",jublix,Houston,"Houston, TX","(29.522325,-95.823268),(30.154665,-95.823268),(30.154665,-95.069705),(29.522325,-95.069705),",30,Downtown,,0
901823213990055936,"Want to work in #Houston, TX? View our latest opening: https://t.co/YJdVDoK77j #IT #Job #Jobs #Hiring #CareerArc",want work view latest opening,Sun Aug 27 10:06:23 CDT 2017,"29.75888,-95.3638571",tmj_HOU_adm,Houston,"Houston, TX","(29.522325,-95.823268),(30.154665,-95.823268),(30.154665,-95.069705),(29.522325,-95.069705),",30,Downtown,,0
901823300313251842,My hero's https://t.co/1UDJ738rCT,hero,Sun Aug 27 10:06:44 CDT 2017,"29.71171171,-95.17995425",SWHTown30,South Houston,"South Houston, TX","(29.650964,-95.249558),(29.670399,-95.249558),(29.670399,-95.20787),(29.650964,-95.20787),",13,Greater Greenspoint,,0
901823589065736192,"Can you recommend anyone for this #job in #Houston, TX? https://t.co/zCpessCI3v #IT #Hiring #CareerArc",recommend anyone,Sun Aug 27 10:07:53 CDT 2017,"29.75888,-95.3638571",tmj_hou_it,Houston,"Houston, TX","(29.522325,-95.823268),(30.154665,-95.823268),(30.154665,-95.069705),(29.522325,-95.069705),",30,Downtown,,0
901823683983015936,A friend of mine took this from their home a bit ago... this is a view of Buffalo Bayou at… https://t.co/pcBa8Uo3Mq,friend mine take home bit ago view buffalo bayou,Sun Aug 27 10:08:15 CDT 2017,"29.7629,-95.3832",chuckpryor,Houston,"Houston, TX","(29.522325,-95.823268),(30.154665,-95.823268),(30.154665,-95.069705),(29.522325,-95.069705),",34,Greater Fifth Ward,home,1
901823752287035393,View from my front porch is thankfully mostly clear. A little pooling in the sidewalk but I'm… https://t.co/1FWNBpVv7I,view front porch thankfully mostly clear little pool sidewalk,Sun Aug 27 10:08:32 CDT 2017,"29.80107825,-95.3819301",jorlyfish,Houston,"Houston, TX","(29.522325,-95.823268),(30.154665,-95.823268),(30.154665,-95.069705),(29.522325,-95.069705),",30,Downtown,,0
901823802732027904,Can you recommend anyone for this #job? Store Counter Sales - #hiring #career https://t.co/RMlAmq0V2W,recommend anyone store counter sales,Sun Aug 27 10:08:44 CDT 2017,"29.6913678,-95.498685",tmj_hou_sales,Houston,"Houston, TX","(29.522325,-95.823268),(30.154665,-95.823268),(30.154665,-95.069705),(29.522325,-95.069705),",30,Downtown,store,1
901823975508119552,HOUSTON BAJO EL AGUA | Se reportan fuertes inundaciones en #Houston por el #HuracanHarvey. Si se… https://t.co/CxZh4EiPul,houston bajo agua reportan fuertes inundaciones por,Sun Aug 27 10:09:25 CDT 2017,"29.7629,-95.3832",venezuelaunete_,Houston,"Houston, TX","(29.522325,-95.823268),(30.154665,-95.823268),(30.154665,-95.069705),(29.522325,-95.069705),",30,Downtown,,0
901824104453382144,We're #hiring! Read about our latest #job opening here: Research Assistant I - Infectious Disease - https://t.co/b3qDmZooxc #Healthcare,read latest opening research assistant infectious disease,Sun Aug 27 10:09:56 CDT 2017,"29.7604267,-95.3698028",tmj_hou_health,Houston,"Houston, TX","(29.522325,-95.823268),(30.154665,-95.823268),(30.154665,-95.069705),(29.522325,-95.069705),",1,Fourth Ward,,0
901824234585939968,"This #job might be a great fit for you: Sr. Endoscopy Technician - https://t.co/cKbpfN4uZ9 #Professional #Houston, TX #Hiring",might great fit endoscopy technician,Sun Aug 27 10:10:27 CDT 2017,"29.7604267,-95.3698028",tmj_hou_mgmt,Houston,"Houston, TX","(29.522325,-95.823268),(30.154665,-95.823268),(30.154665,-95.069705),(29.522325,-95.069705),",73,Clear Lake,,0
901824398398652417,"We're #hiring! Read about our latest #job opening here: Instructor, Respiratory Therapist - https://t.co/YyTZNWD0z2 #Education #Houston, TX",read latest opening instructor respiratory therapist,Sun Aug 27 10:11:06 CDT 2017,"29.7038816,-95.4050529",tmj_hou_edu,Houston,"Houston, TX","(29.522325,-95.823268),(30.154665,-95.823268),(30.154665,-95.069705),(29.522325,-95.069705),",1,Fourth Ward,,0
901824689776951296,"This #job might be a great fit for you: Student Worker - https://t.co/xIkVoG4LkZ #Clerical #Houston, TX #Hiring #CareerArc",might great fit student worker,Sun Aug 27 10:12:15 CDT 2017,"29.8025458,-95.4542613",tmj_hou_cler,Houston,"Houston, TX","(29.522325,-95.823268),(30.154665,-95.823268),(30.154665,-95.069705),(29.522325,-95.069705),",80,Greater Third Ward,,0
901824707099451392,"We're #hiring! Read about our latest #job opening here: Store Team Member - https://t.co/cmC8qc8AQB #Labor #Houston, TX",read latest opening store team member,Sun Aug 27 10:12:19 CDT 2017,"29.7604267,-95.3698028",tmj_hou_labor,Houston,"Houston, TX","(29.522325,-95.823268),(30.154665,-95.823268),(30.154665,-95.069705),(29.522325,-95.069705),",36,Lazy Brook / Timbergrove,store,1
901824845750599682,#tmt #tbe song by #justtouch (I'm a star) #ridethiswave #immashowyouhowtodothis #lasvegas… https://t.co/0prf3HmkLN,song star,Sun Aug 27 10:12:52 CDT 2017,"29.73,-95.36",touchawe,Houston,"Houston, TX","(29.522325,-95.823268),(30.154665,-95.823268),(30.154665,-95.069705),(29.522325,-95.069705),",30,Downtown,,0
901824866428563456,Jayden and I had to make our run. I couldn't take it anymore. My nerves are way too bad! (@ Starbucks) https://t.co/4NJSQZUiM7,jayden make run couldnt take anymore nerves way bad,Sun Aug 27 10:12:57 CDT 2017,"29.99643,-95.572914",misspralexander,Houston,"Houston, TX","(29.522325,-95.823268),(30.154665,-95.823268),(30.154665,-95.069705),(29.522325,-95.069705),",30,Downtown,,0
901824916089184256,"Aviso de Tornado incluye West University Place TX, Southside Place TX hasta las 10:30 AM CDT https://t.co/TaGEUaKEKI",aviso tornado incluye west university place southside place hasta cdt,Sun Aug 27 10:13:09 CDT 2017,"29.69860839,-95.39116702",NWSHouston,Houston,"Houston, TX","(29.522325,-95.823268),(30.154665,-95.823268),(30.154665,-95.069705),(29.522325,-95.069705),",1,Fourth Ward,,0
901825109735776256,I had to tell my neighbors stop playing in the water they making it worse @ Timber Ridge Apts https://t.co/REYEwtAJPJ,tell neighbor stop playing water making worse ridge apts,Sun Aug 27 10:13:55 CDT 2017,"29.77452319,-95.22210459",DJPlayboi713,Houston,"Houston, TX","(29.522325,-95.823268),(30.154665,-95.823268),(30.154665,-95.069705),(29.522325,-95.069705),",30,Downtown,water,1
901825386274807809,High water in three right lanes on SW Fwy NB at The 610 W Lp #traffic https://t.co/vuUN2yElDh,high water three right lane fwy,Sun Aug 27 10:15:01 CDT 2017,"29.72863,-95.46043",TotalTrafficHOU,Houston,"Houston, TX","(29.522325,-95.823268),(30.154665,-95.823268),(30.154665,-95.069705),(29.522325,-95.069705),",30,Downtown,water,1
901825520244948992,"Want to work at CHI St. Luke's Health? We're #hiring in #Houston, TX! Click for details: https://t.co/3hgfGHbpj2 #Healthcare #Job #Jobs",want work chi luke health click details,Sun Aug 27 10:15:33 CDT 2017,"29.7091961,-95.4019527",tmj_hou_health,Houston,"Houston, TX","(29.522325,-95.823268),(30.154665,-95.823268),(30.154665,-95.069705),(29.522325,-95.069705),",37,Greater Heights,,0
901825741318447104,Terrible la situación acá en #houston Calles inundadas por todo lado y es casi imposible moverse… https://t.co/KVWYj5lsf9,terrible situacin call inundadas por todo lado casi imposible moverse,Sun Aug 27 10:16:26 CDT 2017,"29.82940311,-95.44534845",MauricioSports,Houston,"Houston, TX","(29.522325,-95.823268),(30.154665,-95.823268),(30.154665,-95.069705),(29.522325,-95.069705),",30,Downtown,call,1
901825825292509185,"Can you recommend anyone for this #job in #Houston, TX? https://t.co/hdRrJw1pXW #Finance #Hiring #CareerArc",recommend anyone,Sun Aug 27 10:16:46 CDT 2017,"29.7484861,-95.4699173",tmj_hou_finance,Houston,"Houston, TX","(29.522325,-95.823268),(30.154665,-95.823268),(30.154665,-95.069705),(29.522325,-95.069705),",30,Downtown,,0
901825980834037760,"Can you recommend anyone for this #job? Director Research - https://t.co/fCqYau85TF #BusinessMgmt #Houston, TX #Hiring #CareerArc",recommend anyone director research,Sun Aug 27 10:17:23 CDT 2017,"29.7091961,-95.4019527",tmj_hou_mgmt,Houston,"Houston, TX","(29.522325,-95.823268),(30.154665,-95.823268),(30.154665,-95.069705),(29.522325,-95.069705),",4,Greater Hobby Area,,0
901826121800458241,"Want to work at Snap Kitchen? We're #hiring in #Houston, TX! Click for details: https://t.co/IlarW0eb7I #careers #hiring #Frontofhouse",want work snap kitchen click details,Sun Aug 27 10:17:57 CDT 2017,"29.7576924,-95.3704827",SnapKitchenJobs,Houston,"Houston, TX","(29.522325,-95.823268),(30.154665,-95.823268),(30.154665,-95.069705),(29.522325,-95.069705),",8,Northshore,,0
901826199491452928,"Interested in a #job in #Houston, TX? This could be a great fit: https://t.co/dcj1thhFqR #Accounting #Hiring #CareerArc",interest could great fit,Sun Aug 27 10:18:15 CDT 2017,"29.9905486,-95.4044268",tmj_hou_acct,Houston,"Houston, TX","(29.522325,-95.823268),(30.154665,-95.823268),(30.154665,-95.069705),(29.522325,-95.069705),",36,Lazy Brook / Timbergrove,,0
901826234442584065,Braeswood Bayou.  Don't Even think about it.  Hunkered Down in… https://t.co/E7N25xVszU,braeswood bayou dont even think hunker,Sun Aug 27 10:18:24 CDT 2017,"29.69017094,-95.43987733",MoFromPromo,Houston,"Houston, TX","(29.522325,-95.823268),(30.154665,-95.823268),(30.154665,-95.069705),(29.522325,-95.069705),",37,Greater Heights,,0
901826334522880000,"Can you recommend anyone for this #job in #Houston, TX? https://t.co/l123aGhHFg #Education #Hiring #CareerArc",recommend anyone,Sun Aug 27 10:18:47 CDT 2017,"29.7422915,-95.3771798",tmj_hou_edu,Houston,"Houston, TX","(29.522325,-95.823268),(30.154665,-95.823268),(30.154665,-95.069705),(29.522325,-95.069705),",30,Downtown,,0
901826753752117248,"Normal vs today! Stay safe everyone! #houston #hurricaneharvey @ Lazy Brook - Timbergrove, Houston https://t.co/U01QqheIlu",normal today stay safe everyone brook timbergrove houston,Sun Aug 27 10:20:27 CDT 2017,"29.7975391,-95.43774451",ericjtsang,Houston,"Houston, TX","(29.522325,-95.823268),(30.154665,-95.823268),(30.154665,-95.069705),(29.522325,-95.069705),",6,Washington Avenue Coalition / Memorial Park,safe,1
901826778351640576,"This #job might be a great fit for you: Full Charge Bookkeeper - https://t.co/DVWKtmF9oW #Accountemps #Accounting #Houston, TX #Hiring",might great fit full charge bookkeeper,Sun Aug 27 10:20:33 CDT 2017,"29.9905486,-95.4044268",AccountempsJobs,Houston,"Houston, TX","(29.522325,-95.823268),(30.154665,-95.823268),(30.154665,-95.069705),(29.522325,-95.069705),",30,Downtown,,0
901826832172859392,"Can you recommend anyone for this #job? Service Representative - https://t.co/7OMg5RPB8O #customerservice #Houston, TX #Hiring",recommend anyone service representative,Sun Aug 27 10:20:46 CDT 2017,"30.0015633,-95.5813993",tmj_hou_cstsrv,Houston,"Houston, TX","(29.522325,-95.823268),(30.154665,-95.823268),(30.154665,-95.069705),(29.522325,-95.069705),",35,Denver Harbor / Port Houston,service,1
901826905434759168,"See our latest #Houston, TX #job and click to apply: Quality Engineer - https://t.co/jKgEhc8oeT #NettempsJobs #Engineering #Hiring",see latest click apply quality engineer,Sun Aug 27 10:21:04 CDT 2017,"29.77,-95.37",tmj_hou_eng,Houston,"Houston, TX","(29.522325,-95.823268),(30.154665,-95.823268),(30.154665,-95.069705),(29.522325,-95.069705),",78,University Place,,0
901826912820936704,"We're #hiring! Click to apply: Research Assistant I - Infectious Disease - https://t.co/fitagEAVqq #Lab #Laboratory #Houston, TX #Job",click apply research assistant infectious disease,Sun Aug 27 10:21:05 CDT 2017,"29.7604267,-95.3698028",tmj_hou_health,Houston,"Houston, TX","(29.522325,-95.823268),(30.154665,-95.823268),(30.154665,-95.069705),(29.522325,-95.069705),",30,Downtown,,0
901826992814870529,Sharing photos from my husband's phone of our current conditions… https://t.co/ZOKa2031iT,sharing photo husband phone current conditions,Sun Aug 27 10:21:24 CDT 2017,"29.7629,-95.3832",KatrinaSLawson1,Houston,"Houston, TX","(29.522325,-95.823268),(30.154665,-95.823268),(30.154665,-95.069705),(29.522325,-95.069705),",30,Downtown,,0
901827169394900993,"Can you recommend anyone for this #job in #Houston, TX? https://t.co/hLDbhzuyLK #Sales #Hiring #CareerArc",recommend anyone,Sun Aug 27 10:22:06 CDT 2017,"29.8293478,-95.360501",tmj_hou_sales,Houston,"Houston, TX","(29.522325,-95.823268),(30.154665,-95.823268),(30.154665,-95.069705),(29.522325,-95.069705),",14,Iah / Airport Area,,0
901827226798358528,Cobertura del #Harvey en #Houston #TX #PART1 #Specialcoverage #journalist #voanoticias… https://t.co/5fh0xcU2fT,cobertura del,Sun Aug 27 10:22:20 CDT 2017,"29.9253,-95.515",CELIAMENDOZA25,Houston,"Houston, TX","(29.522325,-95.823268),(30.154665,-95.823268),(30.154665,-95.069705),(29.522325,-95.069705),",30,Downtown,,0
901827495753854976,Cobertura del #Harvey en #Houston #TX #PART2 #Specialcoverage #journalist #voanoticias… https://t.co/GWShiMCaUk,cobertura del,Sun Aug 27 10:23:24 CDT 2017,"29.9253,-95.515",CELIAMENDOZA25,Houston,"Houston, TX","(29.522325,-95.823268),(30.154665,-95.823268),(30.154665,-95.069705),(29.522325,-95.069705),",1,Fourth Ward,,0
901827589244940289,Hurricane Harvey blues?  Hit the gym while you still have power!! @ Galleria Area https://t.co/46eri8S3ef,hurricane harvey blues hit gym still power area,Sun Aug 27 10:23:47 CDT 2017,"29.73563317,-95.49816257",Trades2win,Houston,"Houston, TX","(29.522325,-95.823268),(30.154665,-95.823268),(30.154665,-95.069705),(29.522325,-95.069705),",5,Eldridge / West Oaks,power,1
901827766039060480,"#USGS08074800 - Keegans Bayou at Roark Rd nr Houston, TX  Heavy Rain (0.48 in/hr) over the last 15 minutes  https://t.co/8zCvhGbXbn",keegans bayou roark houston heavy rain inhr last minutes,Sun Aug 27 10:24:29 CDT 2017,"29.65662136,-95.5621664",USGS_TexasRain,Houston,"Houston, TX","(29.522325,-95.823268),(30.154665,-95.823268),(30.154665,-95.069705),(29.522325,-95.069705),",1,Fourth Ward,,0
901827972692312065,#PreperationH #Harvey #Moist  #inapropes #THOT #thotsbelike  A few things: Military time I had a… https://t.co/IfQfQnlzso,things military time,Sun Aug 27 10:25:18 CDT 2017,"29.7325207,-95.43408522",bellinissima,Houston,"Houston, TX","(29.522325,-95.823268),(30.154665,-95.823268),(30.154665,-95.069705),(29.522325,-95.069705),",37,Greater Heights,,0
901828219095064576,"Can you recommend anyone for this #job? OUTBOUND FREIGHT HANDLER - https://t.co/BPTD26Q5TI #warehouse #Houston, TX #Hiring",recommend anyone outbound freight handler,Sun Aug 27 10:26:17 CDT 2017,"29.6305783,-95.2956777",tmj_HOU_schn,Houston,"Houston, TX","(29.522325,-95.823268),(30.154665,-95.823268),(30.154665,-95.069705),(29.522325,-95.069705),",1,Fourth Ward,,0
901828270085226497,"We're #hiring! Read about our latest #job opening here: Corporate College Instructor, Industrial Control... - https://t.co/N6LJnrPVFF",read latest opening corporate college instructor industrial control,Sun Aug 27 10:26:29 CDT 2017,"29.9934421,-95.5818048",tmj_hou_edu,Houston,"Houston, TX","(29.522325,-95.823268),(30.154665,-95.823268),(30.154665,-95.069705),(29.522325,-95.069705),",30,Downtown,,0
901828304860176384,"Can you recommend anyone for this #job? Surgical Technician III - CV OR (PRN) - https://t.co/L7mcUbr7m7 #Healthcare #Houston, TX #Hiring",recommend anyone surgical technician iii prn,Sun Aug 27 10:26:37 CDT 2017,"29.7604267,-95.3698028",tmj_hou_health,Houston,"Houston, TX","(29.522325,-95.823268),(30.154665,-95.823268),(30.154665,-95.069705),(29.522325,-95.069705),",34,Greater Fifth Ward,,0
901828339975032833,"Reading for Day Two of Harvey, as suggested by James Robison, with tea in Dalek cup and antlers.… https://t.co/A75NEhLzzt",reading day two harvey suggest james robison tea dalek cup antler,Sun Aug 27 10:26:46 CDT 2017,"29.80874602,-95.39924531",magicfishbones,Houston,"Houston, TX","(29.522325,-95.823268),(30.154665,-95.823268),(30.154665,-95.069705),(29.522325,-95.069705),",2,Greater Uptown,,0
901828511698042880,"Join the 24 Hour Fitness team! See our latest #job opening here: https://t.co/CU9ie38tjt #customerservice #Houston, TX #Hiring",join hour fitness team see latest opening,Sun Aug 27 10:27:27 CDT 2017,"29.7349415,-95.5650417",tmj_hou_cstsrv,Houston,"Houston, TX","(29.522325,-95.823268),(30.154665,-95.823268),(30.154665,-95.069705),(29.522325,-95.069705),",30,Downtown,,0
901828595819188224,Someone did the rain dance alittle too hard... @ Stablewood Farms https://t.co/FuKwr8OWJJ,someone rain dance alittle hard farm,Sun Aug 27 10:27:47 CDT 2017,"29.99646,-95.6684265",Wuod_Dala,Houston,"Houston, TX","(29.522325,-95.823268),(30.154665,-95.823268),(30.154665,-95.069705),(29.522325,-95.069705),",37,Greater Heights,,0
